,Title,Price,Price_Origin,Link,Image,Retailer,TimeStamp,Source
0,"250W LED High Bay Light 35,000LM (140Lm/w) 5000K Daylight (for 18 to 24ft Ceiling, 1000W HID/HPS Replacement) 1-10v dimmer UL Listed HYPERLITE High Bay LED Light for Factory Warehouse Church",189.99,0,https://www.amazon.ca/dp/B07WLVG6RX/,https://m.media-amazon.com/images/I/612N0b-IwbL._AC_UL320_.jpg,Amazon,2021-10-28T16:21:02,https://www.amazon.ca/s?k=lightning+deals
1,"Sengled Smart LED Soft White A19 Starter Kit, 2700K 60W Equivalent, 2 Light Bulbs & Hub, Works with Alexa & Google Assistant",21.00,0,https://www.amazon.ca/dp/B01N2TVDYQ/,https://m.media-amazon.com/images/I/51GJJQiGLLL._AC_UL320_.jpg,Amazon,2021-10-28T16:21:02,https://www.amazon.ca/s?k=lightning+deals
2,"LittleSun LED Garage Light 4+1 Deformable LED Garage Lighting, 48W, 5000LM, CRI 90+, 6500K,Ideal LED Lighting for Garage, Shop,Basement, Warehouse,White, Pack (1)",20.99,0,https://www.amazon.ca/dp/B082N9NTXW/,https://m.media-amazon.com/images/I/717sEGXAhOL._AC_UL320_.jpg,Amazon,2021-10-28T16:21:02,https://www.amazon.ca/s?k=lightning+deals
3,Women's Fleece Lined Water Resistant Legging High Waisted Thermal Winter Hiking Running Tights Pockets,33.99,41.99,https://www.amazon.ca/dp/B08JXGYR3L/,https://m.media-amazon.com/images/I/51qZSUaD8DL._AC_UL320_.jpg,Amazon,2021-10-28T16:21:02,https://www.amazon.ca/s?k=lightning+deals
4,"Womens Color Block Long Sleeve Round Neck Shirts Pullover Sweatshirt Tops, S-2XL",36.99,0,https://www.amazon.ca/dp/B099ZHYP37/,https://m.media-amazon.com/images/I/71giHRSnN7L._AC_UL320_.jpg,Amazon,2021-10-28T16:21:02,https://www.amazon.ca/s?k=lightning+deals
5,LEGO Creator 3in1 Deep Sea Creatures 31088 Building Kit (230 Piece),16.86,19.99,https://www.amazon.ca/dp/B07GWZNF91/,https://m.media-amazon.com/images/I/81PJ7s8nT3L._AC_UL320_.jpg,Amazon,2021-10-28T16:21:02,https://www.amazon.ca/s?k=lightning+deals
6,womens 6 Pack Runner Socks Socks,12.87,22.99,https://www.amazon.ca/dp/B00GOMDIMU/,https://m.media-amazon.com/images/I/81Zh8tgs3EL._AC_UL320_.jpg,Amazon,2021-10-28T16:21:02,https://www.amazon.ca/s?k=lightning+deals
7,Winter Women Socks 5 Pairs Vintage Style Knit Wool Casual Socks Warm Socks,13.90,0,https://www.amazon.ca/dp/B088QQS9DG/,https://m.media-amazon.com/images/I/814P7X3RZOL._AC_UL320_.jpg,Amazon,2021-10-28T16:21:02,https://www.amazon.ca/s?k=lightning+deals
8,"Lindt Lindt Hazelnut Milk Chocolate Spread, 200g, Hazelnut, 200 Grams",5.97,0,https://www.amazon.ca/dp/B07KLMK61V/,https://m.media-amazon.com/images/I/71Ajv8NYcEL._AC_UL320_.jpg,Amazon,2021-10-28T16:21:02,https://www.amazon.ca/s?k=lightning+deals
9,Men's Long-Sleeve T-Shirt,10.48,0,https://www.amazon.ca/dp/B00T7TWF4E/,https://m.media-amazon.com/images/I/81qp6zqycZS._AC_UL320_.jpg,Amazon,2021-10-28T16:21:02,https://www.amazon.ca/s?k=lightning+deals
10,"Monster Wireless Earbuds, True Wireless Earbuds,Bluetooth 5.0 in-Ear Super Fast Charge,Built-in Mics for Clear Calls, USB-C Quick Charge, 24-Hour Playtime, Secure Fit for Sports Black",99.99,0,https://www.amazon.ca/dp/B096SBPYRS/,https://m.media-amazon.com/images/I/61Ok-N1ts2L._AC_UL320_.jpg,Amazon,2021-10-28T16:21:02,https://www.amazon.ca/s?k=lightning+deals
11,"Men's 6"" Boxer Brief Fly Front with Pouch, 3-Pack",19.98,40.00,https://www.amazon.ca/dp/B074JJJQ7Y/,https://m.media-amazon.com/images/I/A1TIe2I2ezL._AC_UL320_.jpg,Amazon,2021-10-28T16:21:02,https://www.amazon.ca/s?k=lightning+deals
12,Mens Crew T-Shirt Multipack,22.25,0,https://www.amazon.ca/dp/B07XVXSY7M/,https://m.media-amazon.com/images/I/71FKlHTAOuL._AC_UL320_.jpg,Amazon,2021-10-28T16:21:02,https://www.amazon.ca/s?k=lightning+deals
13,"Apple Barrel Acrylic Paint in Assorted Colors (2 oz), 21481, Key West",0.97,0,https://www.amazon.ca/dp/B00889Z9YC/,https://m.media-amazon.com/images/I/51OqLh2hJhL._AC_UL320_.jpg,Amazon,2021-10-28T16:21:02,https://www.amazon.ca/s?k=lightning+deals
14,Women's Printed Shawl Wrap Fashionable Open Front Poncho Cape,40.99,0,https://www.amazon.ca/dp/B07DTBY5GX/,https://m.media-amazon.com/images/I/81O21CY+O1L._AC_UL320_.jpg,Amazon,2021-10-28T16:21:02,https://www.amazon.ca/s?k=lightning+deals
15,Utopia Bedding Gusseted Pillow (2-Pack) Premium Quality Bed Pillows - Side Back Sleepers - Blue Gusset - Queen - 18 x 26 Inches,34.99,0,https://www.amazon.ca/dp/B01FXSVBNI/,https://m.media-amazon.com/images/I/51BQIBV9mgS._AC_UL320_.jpg,Amazon,2021-10-28T16:21:02,https://www.amazon.ca/s?k=lightning+deals
16,"Nylon Breathable Military Tactical Style Adjustable Web Men Belt,Black,Suit for Pant Size Below 45 Inches",20.99,0,https://www.amazon.ca/dp/B01D1HAV9I/,https://m.media-amazon.com/images/I/71VY+LLi6DL._AC_UL320_.jpg,Amazon,2021-10-28T16:21:02,https://www.amazon.ca/s?k=lightning+deals
17,Duracell Coppertop AA Alkaline Batteries - 20 Count,18.99,0,https://www.amazon.ca/dp/B002UXRXEG/,https://m.media-amazon.com/images/I/71br624-J4L._AC_UL320_.jpg,Amazon,2021-10-28T16:21:02,https://www.amazon.ca/s?k=lightning+deals
18,"Men’s Crew T-Shirts, Multipack",25.99,0,https://www.amazon.ca/dp/B07JDFPQTC/,https://m.media-amazon.com/images/I/61CqBpL3iUL._AC_UL320_.jpg,Amazon,2021-10-28T16:21:02,https://www.amazon.ca/s?k=lightning+deals
19,Saxx Men's Underwear – Vibe Men’s Underwear – Boxer Briefs with Built-in Ballpark Pouch Support - Core,33.95,0,https://www.amazon.ca/dp/B016OE5PJQ/,https://m.media-amazon.com/images/I/81QxKJJVcDL._AC_UL320_.jpg,Amazon,2021-10-28T16:21:02,https://www.amazon.ca/s?k=lightning+deals
20,"USB Wall Charger Multiport, Surge Protector with Night Light & Shelf, 6 Outlet Extender with 3 USB Ports (1 USB-C Outlet), 3-Sided Power Strip Multi Outlet Wall Plug Adapter for Home Travel Office",30.99,0,https://www.amazon.ca/dp/B09JB4W3H6/,https://m.media-amazon.com/images/I/51b1QeDRE2L._AC_UL320_.jpg,Amazon,2021-10-28T16:21:02,https://www.amazon.ca/s?k=lightning+deals
21,"Monster Wireless Earbuds,Ecouteur Sans Fil Bluetooth,True Wireless Bluetooth Earbuds Waterproof Touch Control Wireless Charging in-Ear Earphones with Microphone Bluetooth 5.0 - Black",49.99,0,https://www.amazon.ca/dp/B08MQPFGYV/,https://m.media-amazon.com/images/I/61ukXyLwU8L._AC_UL320_.jpg,Amazon,2021-10-28T16:21:02,https://www.amazon.ca/s?k=lightning+deals
22,"Outlet Extender Surge Protector with usb, Night Light, Electric Multi Plug Wall Outlet Expander 15 amp, Outlet Shelf, Outlet Multiplier Splitter Adapter indoor for Home, Fast Charge, White(1020J)",35.99,0,https://www.amazon.ca/dp/B083Z5XDTK/,https://m.media-amazon.com/images/I/71mQ17ZOsfL._AC_UL320_.jpg,Amazon,2021-10-28T16:21:02,https://www.amazon.ca/s?k=lightning+deals
23,BISSELL - Stick Vacuum - Featherweight White - Ultra-lightweight and compact - Versatile Lift-Off Hand Vacuum - 2.1 Amp motor in a 3lb vacuum,39.99,0,https://www.amazon.ca/dp/B085PGFW2P/,https://m.media-amazon.com/images/I/51qQxZrptqL._AC_UL320_.jpg,Amazon,2021-10-28T16:21:02,https://www.amazon.ca/s?k=lightning+deals
24,mens Multi-pack Mesh Ventilating Comfort Fit Performance No-show Socks,19.99,0,https://www.amazon.ca/dp/B01D2GRTIE/,https://m.media-amazon.com/images/I/91VvLvJikgL._AC_UL320_.jpg,Amazon,2021-10-28T16:21:02,https://www.amazon.ca/s?k=lightning+deals
25,"Lindt Swiss Classic Milk Chocolate, Bar, 100g",1.97,0,https://www.amazon.ca/dp/B000H299LW/,https://m.media-amazon.com/images/I/71ORKwFp7XL._AC_UL320_.jpg,Amazon,2021-10-28T16:21:02,https://www.amazon.ca/s?k=lightning+deals
26,No Buckle Stretch Belt For Women Men Elastic Waist Belt Up to 72 Inch for Jeans Pants,16.99,0,https://www.amazon.ca/dp/B07CXMNLVG/,https://m.media-amazon.com/images/I/71aNNvLk8oL._AC_UL320_.jpg,Amazon,2021-10-28T16:21:02,https://www.amazon.ca/s?k=lightning+deals
27,"Extra Clean Toothbrush, Full Head, Soft (6 Count)",4.77,0,https://www.amazon.ca/dp/B00CC6XSSQ/,https://m.media-amazon.com/images/I/81l2bK1kAcL._AC_UL320_.jpg,Amazon,2021-10-28T16:21:02,https://www.amazon.ca/s?k=lightning+deals
28,Saxx Men's Underwear – Vibe Men’s Underwear – Boxer Briefs with Built-in Ballpark Pouch Support - Core,33.95,0,https://www.amazon.ca/dp/B016OE5PJQ/,https://m.media-amazon.com/images/I/81QxKJJVcDL._AC_UL320_.jpg,Amazon,2021-10-28T16:21:02,https://www.amazon.ca/s?k=lightning+deals
29,Phone Charger 【5Pack】3FT 3FT 6FT 6FT 10FT Nylon Braided USB Charging & Syncing Cable Compatible with Phone12 12 Pro 12 Max Se Phone 11 Pro Max 11 Pro 11 XS MAX XR X 8 8 Plus 7 7 Plus 6s 6s Plus 6 6 Plus and More (Black),14.98,19.99,https://www.amazon.ca/dp/B07P5MDRP4/,https://m.media-amazon.com/images/I/61a8ZESYqUL._AC_UL320_.jpg,Amazon,2021-10-28T16:21:02,https://www.amazon.ca/s?k=lightning+deals
30,Men's W96H-1BV Classic Sport Watch,30.24,0,https://www.amazon.ca/dp/B000AQVSA0/,https://m.media-amazon.com/images/I/91R8vHW8sDL._AC_UL320_.jpg,Amazon,2021-10-28T16:21:02,https://www.amazon.ca/s?k=lightning+deals
31,"Harem Pants for Women, Cotton Loose High Waist Soft Athletic Elastic Waistband Yoga Pilates Pants",28.98,0,https://www.amazon.ca/dp/B08BZB7139/,https://m.media-amazon.com/images/I/51k9y10y70S._AC_UL320_.jpg,Amazon,2021-10-28T16:21:02,https://www.amazon.ca/s?k=lightning+deals
32,"USB C Charger, INIU [2 Pack] 25W PD 3.0 Fast Charging Mini Wall Charger, Universal Power Adapter Plug Compatible with iPhone 12 11 Pro XR X 8 Samsung S21 S20 Note 20 iPad Airpods Google LG Switch etc.",23.98,0,https://www.amazon.ca/dp/B0965929WQ/,https://m.media-amazon.com/images/I/51QinalHfPS._AC_UL320_.jpg,Amazon,2021-10-28T16:21:02,https://www.amazon.ca/s?k=lightning+deals
33,"Men's Ultra Cotton Adult Long Sleeve T-Shirt, 2-Pack",21.99,0,https://www.amazon.ca/dp/B07683LB6Q/,https://m.media-amazon.com/images/I/61HxBf1puDL._AC_UL320_.jpg,Amazon,2021-10-28T16:21:02,https://www.amazon.ca/s?k=lightning+deals
34,"Tower Power Bar with Surge Protector, Flat Plug Extension Cord Indoor 6.5 Feet, 11 Widely Spaced AC Outlets, 3 USB Ports, TESSAN Power Strip Multi Plug Desk Charging Station, Home Office Accessories",35.99,0,https://www.amazon.ca/dp/B08LR6SGHJ/,https://m.media-amazon.com/images/I/61R4LAuy23S._AC_UL320_.jpg,Amazon,2021-10-28T16:21:02,https://www.amazon.ca/s?k=lightning+deals
35,"Utopia Bedding Premium Bamboo Mattress Protector Twin 340 GSM, Fits 15 Inches Deep, Easy Care",33.99,42.99,https://www.amazon.ca/dp/B01E02DU6E/,https://m.media-amazon.com/images/I/81UMy8pnMxL._AC_UL320_.jpg,Amazon,2021-10-28T16:21:02,https://www.amazon.ca/s?k=lightning+deals
36,"USB Wall Charger, Surge Protector, 5 Outlet Extender with 4 USB Charging Ports ( 1 USB C Outlet, 4.5A Total) 3-Sided 1800J Power Strip Multi Plug Outlets Wall Adapter Spaced for Home Travel Office",25.49,34.99,https://www.amazon.ca/dp/B08Z3GJ4GG/,https://m.media-amazon.com/images/I/31kQUrRzLKL._AC_UL320_.jpg,Amazon,2021-10-28T16:21:02,https://www.amazon.ca/s?k=lightning+deals
37,"Fineliner Pen, Chukchi Fine Line Drawing Pen Fineliner Color Pens Set 0.38mm Colored Fine Line Point Markers Perfect for Coloring Book Bullet Journal Art Projects Pack of 10 Assorted Colors (1 Pack)",8.99,15.99,https://www.amazon.ca/dp/B073S3HFP9/,https://m.media-amazon.com/images/I/611JDfJBhsL._AC_UL320_.jpg,Amazon,2021-10-28T16:21:02,https://www.amazon.ca/s?k=lightning+deals
38,Phone Charger 5Pack 3ft 3ft 6ft 6ft 10ft Nylon Braided Usb Charging & Syncing Cable Compatible with Phone12 12 Pro 12 Max Se Phone 11 Pro Max 11 Pro 11 XS MAX XR X 8 8 Plus 7 7 Plus 6s 6s Plus 6 6 Plus and More (Silver),16.99,0,https://www.amazon.ca/dp/B07R9KDMX1/,https://m.media-amazon.com/images/I/61Y7JeVsaWL._AC_UL320_.jpg,Amazon,2021-10-28T16:21:02,https://www.amazon.ca/s?k=lightning+deals
39,Women's High Waisted Cotton Underwear Stretch Briefs Soft Full Coverage Panties Multipack (Regular& Plus Size),32.99,40.99,https://www.amazon.ca/dp/B07RP7KCPB/,https://m.media-amazon.com/images/I/61dpCKpdjHL._AC_UL320_.jpg,Amazon,2021-10-28T16:21:02,https://www.amazon.ca/s?k=lightning+deals
40,AmazonBasics AAA 1.5 Volt Performance Alkaline Batteries - Pack of 36,12.92,0,https://www.amazon.ca/dp/B00LH3DMUO/,https://m.media-amazon.com/images/I/71nDX36Y9UL._AC_UL320_.jpg,Amazon,2021-10-28T16:21:02,https://www.amazon.ca/s?k=lightning+deals
41,Women's Active Yoga Lounge Capri Pocketed Walking Crop Pants,29.99,43.99,https://www.amazon.ca/dp/B071GBKZVJ/,https://m.media-amazon.com/images/I/618JakIsC9L._AC_UL320_.jpg,Amazon,2021-10-28T16:21:02,https://www.amazon.ca/s?k=lightning+deals
42,"CUISINART 12 Piece Color Knife Set with Blade Guards (6 Knives and 6 Knife Covers), Jewel",40.75,0,https://www.amazon.ca/dp/B016OD70Q8/,https://m.media-amazon.com/images/I/814qPwdR8yL._AC_UL320_.jpg,Amazon,2021-10-28T16:21:02,https://www.amazon.ca/s?k=lightning+deals
43,Womens Women's Totally Shaping Pull on Skinny Jeans,39.99,0,https://www.amazon.ca/dp/B077R4H48C/,https://m.media-amazon.com/images/I/51LRdAQLQfL._AC_UL320_.jpg,Amazon,2021-10-28T16:21:02,https://www.amazon.ca/s?k=lightning+deals
44,"TP-Link N300 WiFi Range Extender TL-WA850RE - Covers up to 800 Sq.ft, Up to 300Mbps, Signal Booster & WiFi Repeater, Single Band 2.4Ghz only, and Compact Wall Plug Design, Extend WiFi Range Further",16.99,22.99,https://www.amazon.ca/dp/B00E98O7GC/,https://m.media-amazon.com/images/I/5162dBZuR2L._AC_UL320_.jpg,Amazon,2021-10-28T16:21:02,https://www.amazon.ca/s?k=lightning+deals
45,"Women Wool Socks for Winter, Vintage Winter Socks Thick Cozy Knit Wool Socks for Women (A- 10 Pairs)",27.80,0,https://www.amazon.ca/dp/B07WFFH2ZC/,https://m.media-amazon.com/images/I/811UQ5wq-UL._AC_UL320_.jpg,Amazon,2021-10-28T16:21:02,https://www.amazon.ca/s?k=lightning+deals
46,AmazonBasics USB 2.0 Printer Cable - A-Male to B-Male Cord - 6 Feet (1.8 Meters),6.79,9.51,https://www.amazon.ca/dp/B00NH11KIK/,https://m.media-amazon.com/images/I/71bhL-Kx6+L._AC_UL320_.jpg,Amazon,2021-10-28T16:21:02,https://www.amazon.ca/s?k=lightning+deals
47,Mens Authentics Classic Relaxed Fit Jean,29.99,0,https://www.amazon.ca/dp/B00XKXW4HG/,https://m.media-amazon.com/images/I/71-KKTMxOsL._AC_UL320_.jpg,Amazon,2021-10-28T16:21:02,https://www.amazon.ca/s?k=lightning+deals
48,"Fire TV Stick 4K streaming device with Alexa built in, Ultra HD, Dolby Vision, includes the Alexa Voice Remote",64.99,69.99,https://www.amazon.ca/dp/B079QH9GG7/,https://m.media-amazon.com/images/I/51CgKGfMelL._AC_UL320_.jpg,Amazon,2021-10-28T16:21:02,https://www.amazon.ca/s?k=lightning+deals
49,High Waisted Compression Leggings - Shapewear for Women,30.99,0,https://www.amazon.ca/dp/B07QKPCF12/,https://m.media-amazon.com/images/I/71vRr6zOdpL._AC_UL320_.jpg,Amazon,2021-10-28T16:21:02,https://www.amazon.ca/s?k=lightning+deals
50,"USB C to Lightning Cable MFi Certified, Quntis 3Pack 3FT 6FT 10FT iPhone 12 Fast Charging Cable Power Delivery Lightning to Type C Charger Cord for iPhone 13/12 Pro Max/11 Pro/X/XS/XR/8 Plus/iPad/AirPods Pro",20.99,0,https://www.amazon.ca/dp/B08QCGLZR6/,https://m.media-amazon.com/images/I/61fL+LMFubL._AC_UL320_.jpg,Amazon,2021-10-28T16:21:02,https://www.amazon.ca/s?k=lightning+deals
51,"Mens Classic-fit 9"" Short",20.10,0,https://www.amazon.ca/dp/B01JQT9AZ6/,https://m.media-amazon.com/images/I/81Kygli5ZTL._AC_UL320_.jpg,Amazon,2021-10-28T16:21:02,https://www.amazon.ca/s?k=lightning+deals
52,Men's Loose Fit Heavyweight Short-Sleeve Pocket T-Shirt,27.22,0,https://www.amazon.ca/dp/B0000E0YRS/,https://m.media-amazon.com/images/I/81NGTHWFapL._AC_UL320_.jpg,Amazon,2021-10-28T16:21:02,https://www.amazon.ca/s?k=lightning+deals
53,"Utopia Bedding Comforter Duvet Insert - Quilted Comforter with Corner Tabs - Box Stitched Down Alternative Comforter (Queen, White)",39.99,46.99,https://www.amazon.ca/dp/B00S1TC442/,https://m.media-amazon.com/images/I/712c0JZxCWL._AC_UL320_.jpg,Amazon,2021-10-28T16:21:02,https://www.amazon.ca/s?k=lightning+deals
54,Men's W-217H-9AVCF Classic Digital Display Quartz Black Watch,26.33,0,https://www.amazon.ca/dp/B0721BB2ZW/,https://m.media-amazon.com/images/I/814xtc+jWVL._AC_UL320_.jpg,Amazon,2021-10-28T16:21:02,https://www.amazon.ca/s?k=lightning+deals
55,Women's High Waisted Cotton Underwear Stretch Briefs Soft Full Coverage Panties Multipack (Regular& Plus Size),29.99,40.99,https://www.amazon.ca/dp/B07RN63526/,https://m.media-amazon.com/images/I/61dpCKpdjHL._AC_UL320_.jpg,Amazon,2021-10-28T16:21:02,https://www.amazon.ca/s?k=lightning+deals
56,"Geek Wireless Earbuds, Bluetooth earbuds with Wireless Charging Exquisite Case USB-C, 36H Playtime Bluetooth Earphones Built-in Mic Dual Calls with 13mm Driver Lossless Sound Fantastic Bass, IPX8 Waterproof Wireless Headphones Travel Sports Headsets",25.49,37.77,https://www.amazon.ca/dp/B09CKSW7FV/,https://m.media-amazon.com/images/I/51JO50ZoLFL._AC_UL320_.jpg,Amazon,2021-10-28T16:21:02,https://www.amazon.ca/s?k=lightning+deals
57,Womens Color Block Tunic Tops Crewneck Long Sleeve T-Shirt Casual Loose Shirt Blouses with Pocket S-XXL,32.99,0,https://www.amazon.ca/dp/B08S3257FY/,https://m.media-amazon.com/images/I/61WQ7S3gLvL._AC_UL320_.jpg,Amazon,2021-10-28T16:21:02,https://www.amazon.ca/s?k=lightning+deals
58,Slim Minimalist Front Pocket RFID Blocking Leather Wallets for Men Women - Cross Black,15.99,0,https://www.amazon.ca/dp/B079DCW7GB/,https://m.media-amazon.com/images/I/81oIi9rFU6L._AC_UL320_.jpg,Amazon,2021-10-28T16:21:02,https://www.amazon.ca/s?k=lightning+deals
59,"Duet 50 Pro Wireless Bluetooth Earbuds. 130 Hour Long Battery Life for iPhone, Android. [Featured in Forbes] Phone Charger Mini Charging Case, Sweatproof TWS Headphones. aptX Sound for Running",69.99,0,https://www.amazon.ca/dp/B085VL4FLB/,https://m.media-amazon.com/images/I/81IngeJKtRS._AC_UL320_.jpg,Amazon,2021-10-28T16:21:02,https://www.amazon.ca/s?k=lightning+deals
60,Saxx Men's Underwear – Vibe Men’s Underwear – Boxer Briefs with Built-in Ballpark Pouch Support - Core,33.95,0,https://www.amazon.ca/dp/B016OE5PJQ/,https://m.media-amazon.com/images/I/81QxKJJVcDL._AC_UL320_.jpg,Amazon,2021-10-28T16:21:02,https://www.amazon.ca/s?k=lightning+deals
61,Women's Fleece Lined Water Resistant Legging High Waisted Thermal Winter Hiking Running Tights Pockets,33.99,41.99,https://www.amazon.ca/dp/B08JZ35F59/,https://m.media-amazon.com/images/I/51qZSUaD8DL._AC_UL320_.jpg,Amazon,2021-10-28T16:21:02,https://www.amazon.ca/s?k=lightning+deals
62,"Lindt Creation Dessert Assorted Chocolates Gift Box, 400 Grams",28.49,0,https://www.amazon.ca/dp/B07G3PS3ZC/,https://m.media-amazon.com/images/I/81auUx+YKRL._AC_UL320_.jpg,Amazon,2021-10-28T16:21:02,https://www.amazon.ca/s?k=lightning+deals
63,Women's Fleece Lined Leggings Winter Yoga Leggings Thermal High Waisted Pocketed Pants,42.99,0,https://www.amazon.ca/dp/B07WV7P745/,https://m.media-amazon.com/images/I/61JhMxQNlKL._AC_UL320_.jpg,Amazon,2021-10-28T16:21:02,https://www.amazon.ca/s?k=lightning+deals
64,"CyberPower P4WSU Professional Surge Protector, 900J/125V, 4 Swivel Outlets, 4 USB Charge Ports, White Wall Tap",29.41,0,https://www.amazon.ca/dp/B07VCGVDSS/,https://m.media-amazon.com/images/I/71tthHfbfnL._AC_UL320_.jpg,Amazon,2021-10-28T16:21:02,https://www.amazon.ca/s?k=lightning+deals
65,Men's Loose Fit Heavyweight Short-Sleeve Pocket T-Shirt,27.22,0,https://www.amazon.ca/dp/B0000E0YRS/,https://m.media-amazon.com/images/I/81NGTHWFapL._AC_UL320_.jpg,Amazon,2021-10-28T16:21:02,https://www.amazon.ca/s?k=lightning+deals
66,6 pcs Aluminum D-Ring Locking Carabiner Light but Strong,13.95,0,https://www.amazon.ca/dp/B01GA3N9MQ/,https://m.media-amazon.com/images/I/81qL6C4yvCL._AC_UL320_.jpg,Amazon,2021-10-28T16:21:02,https://www.amazon.ca/s?k=lightning+deals
67,Men's W-217H-9AVCF Classic Digital Display Quartz Black Watch,26.33,0,https://www.amazon.ca/dp/B0721BB2ZW/,https://m.media-amazon.com/images/I/814xtc+jWVL._AC_UL320_.jpg,Amazon,2021-10-28T16:21:02,https://www.amazon.ca/s?k=lightning+deals
68,Womens 18 Hour Original Comfort Strap Full Coverage Bra Us4693,31.92,0,https://www.amazon.ca/dp/B01M358XZ7/,https://m.media-amazon.com/images/I/81mtNnh5HOL._AC_UL320_.jpg,Amazon,2021-10-28T16:21:02,https://www.amazon.ca/s?k=lightning+deals
69,"INSE Vacuum Cleaner Corded Bagless Stick 18 KPA Powerful Suction, Multipurpose 3 in 1 Handheld Vac with 6m Power Cord",89.99,98.99,https://www.amazon.ca/dp/B08TWSKCP6/,https://m.media-amazon.com/images/I/71XWwvtjDGL._AC_UL320_.jpg,Amazon,2021-10-28T16:21:02,https://www.amazon.ca/s?k=lightning+deals
70,"NICETOWN Window Treatment Blackout Curtains - Kitchen/Dining Room Thermal Insulated Curtains/Rideau de Fenêtre (1 Panel, W52 x L63, Teal Blue)",25.99,0,https://www.amazon.ca/dp/B018JQRUFE/,https://m.media-amazon.com/images/I/519f6iNr8rL._AC_UL320_.jpg,Amazon,2021-10-28T16:21:02,https://www.amazon.ca/s?k=lightning+deals
71,TC-JUNESUN Stick Cordless Vacuum Cleaner 4-in-1 Quiet Suction Fast Charging Lightweight for Home Hard Floor Carpet Car Convenient Handheld (Red),159.00,0,https://www.amazon.ca/dp/B08SM6PVVH/,https://m.media-amazon.com/images/I/51YYVTnpVhL._AC_UL320_.jpg,Amazon,2021-10-28T16:21:02,https://www.amazon.ca/s?k=lightning+deals
72,"3 Pack 10 FT iPhone Charger Fast Charging and Nylon Braided 90 Degree Data Cable for iPhone 12/11/ Pro/Max/X/XS/XR/XS Max/ 8/ Plus/7/7 Plus/6/6S/6 Plus and Other Models (Gray, 10FT)",14.99,0,https://www.amazon.ca/dp/B07QTX1Y2C/,https://m.media-amazon.com/images/I/71Yr1if4lOL._AC_UL320_.jpg,Amazon,2021-10-28T16:21:02,https://www.amazon.ca/s?k=lightning+deals
73,Unisex's Classic Clog,59.99,0,https://www.amazon.ca/dp/B00152AGEW/,https://m.media-amazon.com/images/I/71J+EDTWeQL._AC_UL320_.jpg,Amazon,2021-10-28T16:21:02,https://www.amazon.ca/s?k=lightning+deals
74,"LED Garage Lights 60W-2 Packs LED Garage Lighting 6000LM E26/27 - Deformable LED Shop Light - Garage Ceiling Light, LED Light Bulbs, LED Work Lights, LED High Bay Light for Basement, Workshop",38.99,0,https://www.amazon.ca/dp/B089NTVJF6/,https://m.media-amazon.com/images/I/71iisY6xZaL._AC_UL320_.jpg,Amazon,2021-10-28T16:21:02,https://www.amazon.ca/s?k=lightning+deals
75,4pcs 8mm Natural Healing Stone Bracelets for Men Women Beaded Bracelets Elastic Tree of Life Charm,18.99,0,https://www.amazon.ca/dp/B075ZPJ8JY/,https://m.media-amazon.com/images/I/81ZmqOAdHhL._AC_UL320_.jpg,Amazon,2021-10-28T16:21:02,https://www.amazon.ca/s?k=lightning+deals
76,iwoly V600 Vacuum Cleaner Corded Bagless Stick and Handheld Vacuum with 7m Long Power Cord,69.98,89.99,https://www.amazon.ca/dp/B07RGTV61N/,https://m.media-amazon.com/images/I/717peHM8aLL._AC_UL320_.jpg,Amazon,2021-10-28T16:21:02,https://www.amazon.ca/s?k=lightning+deals
77,Blue Purple Pink Butterfly Crystal Bangle Wrist Link Bracelet Birthday Gift for Women Girls,29.99,0,https://www.amazon.ca/dp/B00U14J0EM/,https://m.media-amazon.com/images/I/61nIdHUFDsL._AC_UL320_.jpg,Amazon,2021-10-28T16:21:02,https://www.amazon.ca/s?k=lightning+deals
78,"Casper Sleep Foam Pillow for Sleeping, Standard, White",135.27,0,https://www.amazon.ca/dp/B07YVRT6WY/,https://m.media-amazon.com/images/I/51HNrlYVXNL._AC_UL320_.jpg,Amazon,2021-10-28T16:21:02,https://www.amazon.ca/s?k=lightning+deals
79,Women's LA670WA-1 Daily Alarm Digital Watch,31.00,0,https://www.amazon.ca/dp/B000GB0G2A/,https://m.media-amazon.com/images/I/71AFLoXJWQL._AC_UL320_.jpg,Amazon,2021-10-28T16:21:02,https://www.amazon.ca/s?k=lightning+deals
80,"250W LED High Bay Light 35,000LM (140Lm/w) 5000K Daylight (for 18 to 24ft Ceiling, 1000W HID/HPS Replacement) 1-10v dimmer UL Listed HYPERLITE High Bay LED Light for Factory Warehouse Church",189.99,0,https://www.amazon.ca/dp/B07WLVG6RX/,https://m.media-amazon.com/images/I/612N0b-IwbL._AC_UL320_.jpg,Amazon,2021-10-28T16:21:02,https://www.amazon.ca/s?k=lightning+deals
81,"LittleSun LED Garage Light 4+1 Deformable LED Garage Lighting, 48W, 5000LM, CRI 90+, 6500K,Ideal LED Lighting for Garage, Shop,Basement, Warehouse,White, Pack (1)",20.99,0,https://www.amazon.ca/dp/B082N9NTXW/,https://m.media-amazon.com/images/I/717sEGXAhOL._AC_UL320_.jpg,Amazon,2021-10-28T16:21:02,https://www.amazon.ca/s?k=lightning+deals
82,Slim Minimalist Front Pocket RFID Blocking Leather Wallets for Men Women - Cross Black,15.99,0,https://www.amazon.ca/dp/B079DCW7GB/,https://m.media-amazon.com/images/I/81oIi9rFU6L._AC_UL320_.jpg,Amazon,2021-10-28T16:21:02,https://www.amazon.ca/s?k=lightning+deals
83,High Waisted Leggings for Women Tummy Control Workout Running Yoga Pants with Pockets,30.99,0,https://www.amazon.ca/dp/B09BMXG3N9/,https://m.media-amazon.com/images/I/61BQlQGKPrL._AC_UL320_.jpg,Amazon,2021-10-28T16:21:02,https://www.amazon.ca/s?k=lightning+deals
84,Womens Modern-Skinny Jean,33.46,0,https://www.amazon.ca/dp/B077R57GTM/,https://m.media-amazon.com/images/I/71Fy9xX5EtL._AC_UL320_.jpg,Amazon,2021-10-28T16:21:02,https://www.amazon.ca/s?k=lightning+deals
85,"New Beats Studio Buds – True Wireless Noise Cancelling Earbuds – Compatible with Apple & Android, Built-in Microphone, IPX4 Rating, Sweat Resistant Earphones, Class 1 Bluetooth Headphones - Black",179.95,0,https://www.amazon.ca/dp/B096SV8SJG/,https://m.media-amazon.com/images/I/51bRSWrEc7S._AC_UL320_.jpg,Amazon,2021-10-28T16:21:02,https://www.amazon.ca/s?k=lightning+deals
86,"Marchpower iPhone Charger, 2 Pack 6ft Lightning Cable with Dual Port iPhone ipad Charger Block Plug, Compatible with iPhone 13 12 SE 11 Pro MAX X XS 8 7 ipad iPod AirPods -White",19.99,0,https://www.amazon.ca/dp/B08G4BBBF2/,https://m.media-amazon.com/images/I/51v6pxu85lL._AC_UL320_.jpg,Amazon,2021-10-28T16:21:02,https://www.amazon.ca/s?k=lightning+deals
87,Short Lightning Cable (2Pack 7Inch) USB Charger Cord for Apple iPhone 13/12/11/Xs Max/Xr/X/8/7/6/6s Plus/SE/5c/5s/5 iPad Air Pro/Mini Phone Charging Wire,11.99,0,https://www.amazon.ca/dp/B07KMQLFMP/,https://m.media-amazon.com/images/I/51ckYln2yUL._AC_UL320_.jpg,Amazon,2021-10-28T16:21:02,https://www.amazon.ca/s?k=lightning+deals
