Title,Price,Price_Origin,Link,Image,Retailer,TimeStamp,Source,Delta
"Monster Wireless Earbuds, True Wireless Earbuds,Bluetooth 5.0 in-Ear Super Fast Charge,Built-in Mics for Clear Calls, USB-C Quick Charge, 24-Hour Playtime, Secure Fit for Sports Black",99.99,0,https://www.amazon.ca/dp/B096SBPYRS/,https://m.media-amazon.com/images/I/61Ok-N1ts2L._AC_UL320_.jpg,Amazon,2021-10-31T16:21:02,https://www.amazon.ca/s?k=lightning+deals,-99.99
"Monster Wireless Earbuds, True Wireless Earbuds,Bluetooth 5.0 in-Ear Super Fast Charge,Built-in Mics for Clear Calls, USB-C Quick Charge, 24-Hour Playtime, Secure Fit for Sports Black",99.99,0,https://www.amazon.ca/dp/B096SBPYRS/,https://m.media-amazon.com/images/I/61Ok-N1ts2L._AC_UL320_.jpg,Amazon,2021-10-31T16:21:02,https://www.amazon.ca/s?k=lightning+deals,-99.99
"Bedsure Queen Bed Comforter Dark Grey - All Season Quilted Down Alternative Comforter for Queen Bed, 300GSM Mashine Washable Microfiber Bedding Comforter Duvet Insert with Corner Tabs",93.72,0,https://www.amazon.ca/dp/B087YW72V2/,https://m.media-amazon.com/images/I/61GyjglvuOL._AC_UY218_.jpg,Amazon,2021-10-31T16:21:02,https://www.amazon.ca/s?k=lightning+deals,-93.72
"USB Type C Cable 3A Fast Charging, Pofesun (2-Pack 6.6ft+6.6ft) USB-A to USB-C Fast Charger Nylon Braided Cord Compatible with Samsung Galaxy S10 S10E S9 S8 S20 Plus,Note 10 9 8,Z Flip-Purple,Green",9.99,0,https://www.amazon.ca/dp/B07QTJKDPJ/,https://m.media-amazon.com/images/I/71EW3Jw2fTL._AC_UL320_.jpg,Amazon,2021-10-31T16:21:02,https://www.amazon.ca/s?k=lightning+deals,-9.99
Samson SR850 Professional Studio Reference Headphones,86.64,0,https://www.amazon.ca/dp/B002LBSEQS/,https://m.media-amazon.com/images/I/715nGARR9UL._AC_UY218_.jpg,Amazon,2021-10-31T16:21:02,https://www.amazon.ca/s?k=lightning+deals,-86.64
"Educational Insights Playfoam Classic 4-Pack | Non-Toxic, Never Dries Out | Sensory, Shaping Fun, Great for Slime| Perfect for Ages 3 and Up",8.99,0,https://www.amazon.ca/dp/B00486Y5XA/,https://m.media-amazon.com/images/I/71+KjDis86S._AC_UY218_.jpg,Amazon,2021-10-31T16:21:02,https://www.amazon.ca/s?k=lightning+deals,-8.99
"Colossal Foot File, Professional Foot Scrubber Upgraded Larger Pedicure Rasp Callus Remover Foot Files For Easy Trimming Dead Skin, Callus, Foot Corn, Cracked Heels, Light-weight & Durable",8.95,0,https://www.amazon.ca/dp/B07F3WJPCQ/,https://m.media-amazon.com/images/I/61oYPDKJg-L._AC_UL320_.jpg,Amazon,2021-10-31T16:21:02,https://www.amazon.ca/s?k=lightning+deals,-8.95
Tenda AC10U Smart Gigabit Wi-Fi Router AC1200 Dual Band w/Parental Control + MU-MIMO + Smart WiFi App Management + USB Port,57.23,0,https://www.amazon.ca/dp/B00ES6ZQ7O/,https://m.media-amazon.com/images/I/61N+f3F9lBS._AC_UL320_.jpg,Amazon,2021-10-31T16:21:02,https://www.amazon.ca/s?k=lightning+deals,-57.23
"Lindt Lindt Hazelnut Milk Chocolate Spread, 200g, Hazelnut, 200 Grams",5.97,0,https://www.amazon.ca/dp/B07KLMK61V/,https://m.media-amazon.com/images/I/71Ajv8NYcEL._AC_UL320_.jpg,Amazon,2021-10-31T16:21:02,https://www.amazon.ca/s?k=lightning+deals,-5.97
"Bluetooth Version 5.0 Speaker, Black Soundtank 24 Hours Playtime Bluetooth Speaker with IPX7 Waterproof, 20W Stereo Sound Wireless Speaker with Bass+ Mode, Wireless Stereo Pairing Feature Portable Speaker for Outdoor, Indoor, Camping",49.99,0,https://www.amazon.ca/dp/B09B55HGWJ/,https://m.media-amazon.com/images/I/71vhXdq7VOL._AC_UL320_.jpg,Amazon,2021-10-31T16:21:02,https://www.amazon.ca/s?k=lightning+deals,-49.99
"ALONG FIT Yoga Pants for Women with Phone Pockets, Compression Workout Leggings Tummy Control",49.99,0,https://www.amazon.ca/dp/B07Q6WT2F1/,https://m.media-amazon.com/images/I/51pxVtImiCL._AC_UY218_.jpg,Amazon,2021-10-31T16:21:02,https://www.amazon.ca/s?k=lightning+deals,-49.99
Verbatim 16GB Store ‘n’ Go Dual USB 3.0 Flash Drive for Apple Lightning Devices - Graphite,48.33,0,https://www.amazon.ca/dp/B01FGX6AQ8/,https://m.media-amazon.com/images/I/51Be+37dofL._AC_UL320_.jpg,Amazon,2021-10-31T16:21:02,https://www.amazon.ca/s?k=lightning+deals,-48.33
"Scarleton Casual Fashion Backpack, Purses for women, Backpack for Women, Fashion Backpack for Women, H1608",44.99,0,https://www.amazon.ca/dp/B00UZFS60Q/,https://m.media-amazon.com/images/I/91y36y24IlL._AC_UY218_.jpg,Amazon,2021-10-31T16:21:02,https://www.amazon.ca/s?k=lightning+deals,-44.99
Women's Printed Shawl Wrap Fashionable Open Front Poncho Cape,40.99,0,https://www.amazon.ca/dp/B07DTBY5GX/,https://m.media-amazon.com/images/I/81O21CY+O1L._AC_UL320_.jpg,Amazon,2021-10-31T16:21:02,https://www.amazon.ca/s?k=lightning+deals,-40.99
"Extra Clean Toothbrush, Full Head, Soft (6 Count)",4.77,0,https://www.amazon.ca/dp/B00CC6XSSQ/,https://m.media-amazon.com/images/I/81l2bK1kAcL._AC_UL320_.jpg,Amazon,2021-10-31T16:21:02,https://www.amazon.ca/s?k=lightning+deals,-4.77
Womens Women's Totally Shaping Pull on Skinny Jeans,39.99,0,https://www.amazon.ca/dp/B077R4H48C/,https://m.media-amazon.com/images/I/51LRdAQLQfL._AC_UL320_.jpg,Amazon,2021-10-31T16:21:02,https://www.amazon.ca/s?k=lightning+deals,-39.99
BISSELL - Stick Vacuum - Featherweight White - Ultra-lightweight and compact - Versatile Lift-Off Hand Vacuum - 2.1 Amp motor in a 3lb vacuum,39.99,0,https://www.amazon.ca/dp/B085PGFW2P/,https://m.media-amazon.com/images/I/51qQxZrptqL._AC_UL320_.jpg,Amazon,2021-10-31T16:21:02,https://www.amazon.ca/s?k=lightning+deals,-39.99
"E26 LED Corn Light Bulb 20W Wenscha T10 LED Light Bulbs 100Watt Equivalent 3000K Soft Warm White, 1500 Lumen Super Bright LED Desk Lamp Aquarium Pendant Light Tubular Bulb Non-Dimmable Pack of 4",39.99,0,https://www.amazon.ca/dp/B08QMR5VQS/,https://m.media-amazon.com/images/I/61gAaj99QuS._AC_UY218_.jpg,Amazon,2021-10-31T16:21:02,https://www.amazon.ca/s?k=lightning+deals,-39.99
Yesurprise Men's Thermal Underwear Sets Top & Long Johns Fleece Sweat Quick Drying,39.99,0,https://www.amazon.ca/dp/B07XPMH7FY/,https://m.media-amazon.com/images/I/618gXchAQBL._AC_UY218_.jpg,Amazon,2021-10-31T16:21:02,https://www.amazon.ca/s?k=lightning+deals,-39.99
"FunVZU Inflatable Paddle Boards - Stand up Paddleboard - Non-Slip, Durable and Lightweight Inflatable SUP 10'6"" x 32"" x 6"" iSUP Package with All Accessories",369.99,0,https://www.amazon.ca/dp/B097LC52MR/,https://m.media-amazon.com/images/I/71ewHRHiFPL._AC_UL320_.jpg,Amazon,2021-10-31T16:21:02,https://www.amazon.ca/s?k=lightning+deals,-369.99
"Womens Color Block Long Sleeve Round Neck Shirts Pullover Sweatshirt Tops, S-2XL",36.99,0,https://www.amazon.ca/dp/B099ZHYP37/,https://m.media-amazon.com/images/I/71giHRSnN7L._AC_UL320_.jpg,Amazon,2021-10-31T16:21:02,https://www.amazon.ca/s?k=lightning+deals,-36.99
"imrusan Womens Tops Crew Neck Soft T-Shirts Solid Color Sleeveless/Long Sleeve Tunic Casual Loose Blouses, S-2XL",36.99,0,https://www.amazon.ca/dp/B09BN2Q4J5/,https://m.media-amazon.com/images/I/71MVR8rsKiL._AC_UY218_.jpg,Amazon,2021-10-31T16:21:02,https://www.amazon.ca/s?k=lightning+deals,-36.99
"Tower Power Bar with Surge Protector, Flat Plug Extension Cord Indoor 6.5 Feet, 11 Widely Spaced AC Outlets, 3 USB Ports, TESSAN Power Strip Multi Plug Desk Charging Station, Home Office Accessories",35.99,0,https://www.amazon.ca/dp/B08LR6SGHJ/,https://m.media-amazon.com/images/I/61R4LAuy23S._AC_UL320_.jpg,Amazon,2021-10-31T16:21:02,https://www.amazon.ca/s?k=lightning+deals,-35.99
"Tower Power Bar with Surge Protector, Flat Plug Extension Cord Indoor 6.5 Feet, 11 Widely Spaced AC Outlets, 3 USB Ports, TESSAN Power Strip Multi Plug Desk Charging Station, Home Office Accessories",35.99,0,https://www.amazon.ca/dp/B08LR6SGHJ/,https://m.media-amazon.com/images/I/61R4LAuy23S._AC_UL320_.jpg,Amazon,2021-10-31T16:21:02,https://www.amazon.ca/s?k=lightning+deals,-35.99
"Repel Umbrella Windproof Travel Umbrella - Compact, Light, Automatic, Strong and Portable - Wind Resistant, Small Folding Backpack Umbrella for Rain - Men and Women",35.95,0,https://www.amazon.ca/dp/B0160HYB8S/,https://m.media-amazon.com/images/I/51mF+wacbfS._AC_UL320_.jpg,Amazon,2021-10-31T16:21:02,https://www.amazon.ca/s?k=lightning+deals,-35.95
POLARPRA 150W LED Garage Lights - 15000LM LED Garage Ceiling Lights with 8 Adjustable LED Panels - 6500K Deformable Garage LED Lighting E26/E27 Screw in Garage Lights for Basement Warehouse Attic,35.65,0,https://www.amazon.ca/dp/B08TBZ7LPH/,https://m.media-amazon.com/images/I/61zDGwT42NL._AC_UY218_.jpg,Amazon,2021-10-31T16:21:02,https://www.amazon.ca/s?k=lightning+deals,-35.65
Utopia Bedding Gusseted Pillow (2-Pack) Premium Quality Bed Pillows - Side Back Sleepers - Blue Gusset - Queen - 18 x 26 Inches,34.99,0,https://www.amazon.ca/dp/B01FXSVBNI/,https://m.media-amazon.com/images/I/51BQIBV9mgS._AC_UL320_.jpg,Amazon,2021-10-31T16:21:02,https://www.amazon.ca/s?k=lightning+deals,-34.99
Saxx Men's Underwear – Vibe Men’s Underwear – Boxer Briefs with Built-in Ballpark Pouch Support - Core,33.95,0,https://www.amazon.ca/dp/B016OE5PJQ/,https://m.media-amazon.com/images/I/81QxKJJVcDL._AC_UL320_.jpg,Amazon,2021-10-31T16:21:02,https://www.amazon.ca/s?k=lightning+deals,-33.95
Saxx Men's Underwear – Vibe Men’s Underwear – Boxer Briefs with Built-in Ballpark Pouch Support - Core,33.95,0,https://www.amazon.ca/dp/B016OE5PJQ/,https://m.media-amazon.com/images/I/81QxKJJVcDL._AC_UL320_.jpg,Amazon,2021-10-31T16:21:02,https://www.amazon.ca/s?k=lightning+deals,-33.95
Saxx Men's Underwear – Vibe Men’s Underwear – Boxer Briefs with Built-in Ballpark Pouch Support - Core,33.95,0,https://www.amazon.ca/dp/B016OE5PJQ/,https://m.media-amazon.com/images/I/81QxKJJVcDL._AC_UL320_.jpg,Amazon,2021-10-31T16:21:02,https://www.amazon.ca/s?k=lightning+deals,-33.95
Saucony womens Performance Heel Tab Athletic Socks (8 & 16 Pairs),32.49,0,https://www.amazon.ca/dp/B07MRC3ZC2/,https://m.media-amazon.com/images/I/91x8tpSy3TL._AC_UL320_.jpg,Amazon,2021-10-31T16:21:02,https://www.amazon.ca/s?k=lightning+deals,-32.49
"APC 1500VA UPS Battery Backup & Surge Protector, APC UPS Back-UPS Pro (BX1500M)",315.39,0,https://www.amazon.ca/dp/B06VY6FXMM/,https://m.media-amazon.com/images/I/81lgJ++wufL._AC_UL320_.jpg,Amazon,2021-10-31T16:21:02,https://www.amazon.ca/s?k=lightning+deals,-315.39
Playtex Womens 18 Hour Original Comfort Strap Full Coverage Bra Us4693,31.92,0,https://www.amazon.ca/dp/B01M358XZ7/,https://m.media-amazon.com/images/I/81mtNnh5HOL._AC_UL320_.jpg,Amazon,2021-10-31T16:21:02,https://www.amazon.ca/s?k=lightning+deals,-31.92
Women's LA670WA-1 Daily Alarm Digital Watch,31.00,0,https://www.amazon.ca/dp/B000GB0G2A/,https://m.media-amazon.com/images/I/71AFLoXJWQL._AC_UL320_.jpg,Amazon,2021-10-31T16:21:02,https://www.amazon.ca/s?k=lightning+deals,-31.0
High Waisted Compression Leggings - Shapewear for Women,30.99,0,https://www.amazon.ca/dp/B07QKPCF12/,https://m.media-amazon.com/images/I/71vRr6zOdpL._AC_UL320_.jpg,Amazon,2021-10-31T16:21:02,https://www.amazon.ca/s?k=lightning+deals,-30.99
"USB Wall Charger Multiport, Surge Protector with Night Light & Shelf, 6 Outlet Extender with 3 USB Ports (1 USB-C Outlet), 3-Sided Power Strip Multi Outlet Wall Plug Adapter for Home Travel Office",30.99,0,https://www.amazon.ca/dp/B09JB4W3H6/,https://m.media-amazon.com/images/I/51b1QeDRE2L._AC_UL320_.jpg,Amazon,2021-10-31T16:21:02,https://www.amazon.ca/s?k=lightning+deals,-30.99
Men's W96H-1BV Classic Sport Watch,30.37,0,https://www.amazon.ca/dp/B000AQVSA0/,https://m.media-amazon.com/images/I/91R8vHW8sDL._AC_UL320_.jpg,Amazon,2021-10-31T16:21:02,https://www.amazon.ca/s?k=lightning+deals,-30.37
Oyamiki Women's Notch-V Neck Long Sleeve Roll-Up Sleeve Zip Up Casual Shirt Blouse Tops,29.99,0,https://www.amazon.ca/dp/B07R4X8MF9/,https://m.media-amazon.com/images/I/71yVvZAXQ+L._AC_UY218_.jpg,Amazon,2021-10-31T16:21:02,https://www.amazon.ca/s?k=lightning+deals,-29.99
"Wireless F9 Earbuds with Touch Control, Original F9-5 Bluetooth Earphones 5.0 TWS Fingerprint Touch Headset HiFi Stereo in-Ear Earbuds Wireless Headphones for Sport",29.99,0,https://www.amazon.ca/dp/B09HT1XRSX/,https://m.media-amazon.com/images/I/31RaPKYL6OL._AC_UL320_.jpg,Amazon,2021-10-31T16:21:02,https://www.amazon.ca/s?k=lightning+deals,-29.99
"EverBrite 5-Pack LED Headlamp Flashlight for Running, Camping, Reading, Fishing, Hunting, Walking, Jogging - Head Lamps Long Battery Life (Batteries Included), Durable, Lightweight",29.99,0,https://www.amazon.ca/dp/B01CTX7BX4/,https://m.media-amazon.com/images/I/81cFtahSCrL._AC_UL320_.jpg,Amazon,2021-10-31T16:21:02,https://www.amazon.ca/s?k=lightning+deals,-29.99
"CyberPower P4WSU Professional Surge Protector, 900J/125V, 4 Swivel Outlets, 4 USB Charge Ports, White Wall Tap",29.41,0,https://www.amazon.ca/dp/B07VCGVDSS/,https://m.media-amazon.com/images/I/71tthHfbfnL._AC_UL320_.jpg,Amazon,2021-10-31T16:21:02,https://www.amazon.ca/s?k=lightning+deals,-29.41
Womens Long Sleeve Short Sleeve Lace Hem Trim Shirts A-Line Tunic Tops,28.99,0,https://www.amazon.ca/dp/B095LNSC2G/,https://m.media-amazon.com/images/I/61HMoJHF5lS._AC_UL320_.jpg,Amazon,2021-10-31T16:21:02,https://www.amazon.ca/s?k=lightning+deals,-28.99
M GOO Kim Women's Cotton Underwear Lace Hipster Panties Briefs Assorted,28.99,0,https://www.amazon.ca/dp/B08DK68NMQ/,https://m.media-amazon.com/images/I/61-OFBGsBNL._AC_UL320_.jpg,Amazon,2021-10-31T16:21:02,https://www.amazon.ca/s?k=lightning+deals,-28.99
"Portable Charger, VYLEE Power Bank 16800mAh Ultra Slim USB Battery Charger, 4 Output Dual Input External Battery Pack with Flashlight, Backup Battery with LCD Display Compatible with All Mobile Phone",28.99,0,https://www.amazon.ca/dp/B09CPWDT1K/,https://m.media-amazon.com/images/I/819sUbfupxL._AC_UL320_.jpg,Amazon,2021-10-31T16:21:02,https://www.amazon.ca/s?k=lightning+deals,-28.99
"BeautyWill Harem Pants for Women, Cotton Loose High Waist Soft Athletic Elastic Waistband Yoga Pilates Pants",28.98,0,https://www.amazon.ca/dp/B08BZB7139/,https://m.media-amazon.com/images/I/51k9y10y70S._AC_UL320_.jpg,Amazon,2021-10-31T16:21:02,https://www.amazon.ca/s?k=lightning+deals,-28.98
"Harem Pants for Women, Cotton Loose High Waist Soft Athletic Elastic Waistband Yoga Pilates Pants",28.98,0,https://www.amazon.ca/dp/B08BZB7139/,https://m.media-amazon.com/images/I/51k9y10y70S._AC_UL320_.jpg,Amazon,2021-10-31T16:21:02,https://www.amazon.ca/s?k=lightning+deals,-28.98
"Kodak Ultra Mini Portable Projector 75 Lumens - HD LED DLP Rechargeable Projector 100” Display, Built-in Speaker - HDMI, USB and Micro SD - Compatible with iOS and Android Devices",258.99,0,https://www.amazon.ca/dp/B078NCG82N/,https://m.media-amazon.com/images/I/81fUfR087+L._AC_UL320_.jpg,Amazon,2021-10-31T16:21:02,https://www.amazon.ca/s?k=lightning+deals,-258.99
Zentrex Women's Racerback Sports Bra High Impact Support for Yoga Workout Gym Activewear Bra,25.99,0,https://www.amazon.ca/dp/B09BQPLPG9/,https://m.media-amazon.com/images/I/61Vu+PxZ4nS._AC_UL320_.jpg,Amazon,2021-10-31T16:21:02,https://www.amazon.ca/s?k=lightning+deals,-25.99
"Men’s Crew T-Shirts, Multipack",25.99,0,https://www.amazon.ca/dp/B07JDFPQTC/,https://m.media-amazon.com/images/I/61CqBpL3iUL._AC_UL320_.jpg,Amazon,2021-10-31T16:21:02,https://www.amazon.ca/s?k=lightning+deals,-25.99
Womens 4 Pack Tank Tops Sleeveless Tops Shirt Slim Fit Ribbed Knit Racerback Blouses,25.99,0,https://www.amazon.ca/dp/B092S18XHP/,https://m.media-amazon.com/images/I/71CGObWaDiL._AC_UY218_.jpg,Amazon,2021-10-31T16:21:02,https://www.amazon.ca/s?k=lightning+deals,-25.99
"Apple Gift Card - App Store, iTunes, iPhone, iPad, AirPods, MacBook, accessories and more (Email Delivery)",25.00,0,https://www.amazon.ca/dp/B093GZFS5Q/,https://m.media-amazon.com/images/I/41SNPx9tOFS._AC_UL320_.jpg,Amazon,2021-10-31T16:21:02,https://www.amazon.ca/s?k=lightning+deals,-25.0
"Apple Gift Card - App Store, iTunes, iPhone, iPad, AirPods, MacBook, accessories and more (Email Delivery)",25.00,0,https://www.amazon.ca/dp/B093GZFS5Q/,https://m.media-amazon.com/images/I/41SNPx9tOFS._AC_UL320_.jpg,Amazon,2021-10-31T16:21:02,https://www.amazon.ca/s?k=lightning+deals,-25.0
Bluetooth Wireless Speakers Waterproof IPX5 with HD Enhanced Bass Outdoor Wireless Portable Phone Speakers Built-in Mic Support FM AUX TF Card USB for iPhone iPad Android Phones Computer Etc. (Blue),23.99,0,https://www.amazon.ca/dp/B078YMPPDV/,https://m.media-amazon.com/images/I/71-qR6q5-GS._AC_UL320_.jpg,Amazon,2021-10-31T16:21:02,https://www.amazon.ca/s?k=lightning+deals,-23.99
"[Apple MFi Certified] Lightning to HDMI Adapter, Compatible with iPhone to HDMI Adapter Cable, 4K 1080P Lightning to Digital AV HDMI adapter with Charging Port for iPhone, iPad, iPod on HD TV/Monitor/Projector-White",23.99,0,https://www.amazon.ca/dp/B09DK7728Q/,https://m.media-amazon.com/images/I/41GKxzhGm2S._AC_UL320_.jpg,Amazon,2021-10-31T16:21:02,https://www.amazon.ca/s?k=lightning+deals,-23.99
"HDMI Adapter for Phone to TV,1080P Digital AV Adapter Compatible with Phone, Sync Screen Connector Directly Connect on TV/Monitor/Projector ect NO Need Power Supply (Grey)",23.99,0,https://www.amazon.ca/dp/B08QHDYP64/,https://m.media-amazon.com/images/I/51DmA7LM3pL._AC_UL320_.jpg,Amazon,2021-10-31T16:21:02,https://www.amazon.ca/s?k=lightning+deals,-23.99
"USB C Charger, INIU [2 Pack] 25W PD 3.0 Fast Charging Mini Wall Charger, Universal Power Adapter Plug Compatible with iPhone 12 11 Pro XR X 8 Samsung S21 S20 Note 20 iPad Airpods Google LG Switch etc.",23.98,0,https://www.amazon.ca/dp/B0965929WQ/,https://m.media-amazon.com/images/I/51QinalHfPS._AC_UL320_.jpg,Amazon,2021-10-31T16:21:02,https://www.amazon.ca/s?k=lightning+deals,-23.98
"USB C Charger, INIU [2 Pack] 25W PD 3.0 Fast Charging Mini Wall Charger, Universal Power Adapter Plug Compatible with iPhone 12 11 Pro XR X 8 Samsung S21 S20 Note 20 iPad Airpods Google LG Switch etc.",23.98,0,https://www.amazon.ca/dp/B0965929WQ/,https://m.media-amazon.com/images/I/51QinalHfPS._AC_UL320_.jpg,Amazon,2021-10-31T16:21:02,https://www.amazon.ca/s?k=lightning+deals,-23.98
"Bose SoundLink Revolve, the Portable Bluetooth Speaker with 360 Wireless Surround Sound, Lux Gray",224.99,0,https://www.amazon.ca/dp/B06XCYGH1C/,https://m.media-amazon.com/images/I/81G616VwuXL._AC_UL320_.jpg,Amazon,2021-10-31T16:21:02,https://www.amazon.ca/s?k=lightning+deals,-224.99
"Smart Home Starter Kit, YoLink 1/4 Mile World's Longest Range Wireless Door Sensor, Water Leak Sensor, and Smart Plug Compatible with Amazon Alexa IFTTT, Smart Home Security Kit, YoLink Hub Included",216.23,0,https://www.amazon.ca/dp/B07V246GCX/,https://m.media-amazon.com/images/I/61BiHFHBtbL._AC_UL320_.jpg,Amazon,2021-10-31T16:21:02,https://www.amazon.ca/s?k=lightning+deals,-216.23
"Men's Ultra Cotton Adult Long Sleeve T-Shirt, 2-Pack",21.99,0,https://www.amazon.ca/dp/B07683LB6Q/,https://m.media-amazon.com/images/I/61HxBf1puDL._AC_UL320_.jpg,Amazon,2021-10-31T16:21:02,https://www.amazon.ca/s?k=lightning+deals,-21.99
Mens Crew T-Shirt Multipack,21.93,0,https://www.amazon.ca/dp/B07XVXSY7M/,https://m.media-amazon.com/images/I/71FKlHTAOuL._AC_UL320_.jpg,Amazon,2021-10-31T16:21:02,https://www.amazon.ca/s?k=lightning+deals,-21.93
"Sengled Smart LED Soft White A19 Starter Kit, 2700K 60W Equivalent, 2 Light Bulbs & Hub, Works with Alexa & Google Assistant",21.00,0,https://www.amazon.ca/dp/B01N2TVDYQ/,https://m.media-amazon.com/images/I/51GJJQiGLLL._AC_UL320_.jpg,Amazon,2021-10-31T16:21:02,https://www.amazon.ca/s?k=lightning+deals,-21.0
"Aiibe 64GB USB Stick 2Pack Metal USB Drive Thumb Drive 64GB USB 2.0 Memory Stick Waterproof USB Flash Drive with Keyring Jump Drive Zip Drives (64G, 2 Colors: Black Silver)",20.99,0,https://www.amazon.ca/dp/B092CZN8FD/,https://m.media-amazon.com/images/I/41Z79TGH2oS._AC_UL320_.jpg,Amazon,2021-10-31T16:21:02,https://www.amazon.ca/s?k=lightning+deals,-20.99
"USB C to Lightning Cable MFi Certified, Quntis 3Pack 3FT 6FT 10FT iPhone 12 Fast Charging Cable Power Delivery Lightning to Type C Charger Cord for iPhone 13/12 Pro Max/11 Pro/X/XS/XR/8 Plus/iPad/AirPods Pro",20.99,0,https://www.amazon.ca/dp/B08QCGLZR6/,https://m.media-amazon.com/images/I/61fL+LMFubL._AC_UL320_.jpg,Amazon,2021-10-31T16:21:02,https://www.amazon.ca/s?k=lightning+deals,-20.99
Fruit of the Loom Women’s Built Up Tank Style Sports Bra,20.99,0,https://www.amazon.ca/dp/B07KSRF8N8/,https://m.media-amazon.com/images/I/71UZglYTV6L._AC_UL320_.jpg,Amazon,2021-10-31T16:21:02,https://www.amazon.ca/s?k=lightning+deals,-20.99
"USB C to Lightning Cable MFi Certified, Quntis 3Pack 3FT 6FT 10FT iPhone 12 Fast Charging Cable Power Delivery Lightning to Type C Charger Cord for iPhone 13/12 Pro Max/11 Pro/X/XS/XR/8 Plus/iPad/AirPods Pro",20.99,0,https://www.amazon.ca/dp/B08QCGLZR6/,https://m.media-amazon.com/images/I/61fL+LMFubL._AC_UL320_.jpg,Amazon,2021-10-31T16:21:02,https://www.amazon.ca/s?k=lightning+deals,-20.99
"Nylon Breathable Military Tactical Style Adjustable Web Men Belt,Black,Suit for Pant Size Below 45 Inches",20.99,0,https://www.amazon.ca/dp/B01D1HAV9I/,https://m.media-amazon.com/images/I/71VY+LLi6DL._AC_UL320_.jpg,Amazon,2021-10-31T16:21:02,https://www.amazon.ca/s?k=lightning+deals,-20.99
Hanes Women's Jersey Full Zip Hoodie,20.64,0,https://www.amazon.ca/dp/B016YKLC92/,https://m.media-amazon.com/images/I/81bO1PWtEUL._AC_UL320_.jpg,Amazon,2021-10-31T16:21:02,https://www.amazon.ca/s?k=lightning+deals,-20.64
mens Multi-pack Mesh Ventilating Comfort Fit Performance No-show Socks,19.99,0,https://www.amazon.ca/dp/B01D2GRTIE/,https://m.media-amazon.com/images/I/91VvLvJikgL._AC_UL320_.jpg,Amazon,2021-10-31T16:21:02,https://www.amazon.ca/s?k=lightning+deals,-19.99
Saucony mens Multi-pack Mesh Ventilating Comfort Fit Performance No-show Socks,19.99,0,https://www.amazon.ca/dp/B01D2GRTIE/,https://m.media-amazon.com/images/I/91VvLvJikgL._AC_UL320_.jpg,Amazon,2021-10-31T16:21:02,https://www.amazon.ca/s?k=lightning+deals,-19.99
"Mens Leather Bracelet Magnetic-Clasp Cowhide Braided Multi-Layer Wrap Mens Bracelet,7""-8.7""",19.99,0,https://www.amazon.ca/dp/B01I174YPK/,https://m.media-amazon.com/images/I/61pqEbnCTGL._AC_UL320_.jpg,Amazon,2021-10-31T16:21:02,https://www.amazon.ca/s?k=lightning+deals,-19.99
"Marchpower iPhone Charger, 2 Pack 6ft Lightning Cable with Dual Port iPhone ipad Charger Block Plug, Compatible with iPhone 13 12 SE 11 Pro MAX X XS 8 7 ipad iPod AirPods -White",19.99,0,https://www.amazon.ca/dp/B08G4BBBF2/,https://m.media-amazon.com/images/I/51v6pxu85lL._AC_UL320_.jpg,Amazon,2021-10-31T16:21:02,https://www.amazon.ca/s?k=lightning+deals,-19.99
"250W LED High Bay Light 35,000LM (140Lm/w) 5000K Daylight (for 18 to 24ft Ceiling, 1000W HID/HPS Replacement) 1-10v dimmer UL Listed HYPERLITE High Bay LED Light for Factory Warehouse Church",189.99,0,https://www.amazon.ca/dp/B07WLVG6RX/,https://m.media-amazon.com/images/I/612N0b-IwbL._AC_UL320_.jpg,Amazon,2021-10-31T16:21:02,https://www.amazon.ca/s?k=lightning+deals,-189.99
"250W LED High Bay Light 35,000LM (140Lm/w) 5000K Daylight (for 18 to 24ft Ceiling, 1000W HID/HPS Replacement) 1-10v dimmer UL Listed HYPERLITE High Bay LED Light for Factory Warehouse Church",189.99,0,https://www.amazon.ca/dp/B07WLVG6RX/,https://m.media-amazon.com/images/I/612N0b-IwbL._AC_UL320_.jpg,Amazon,2021-10-31T16:21:02,https://www.amazon.ca/s?k=lightning+deals,-189.99
"Tenda Nova MW6(3-Pack) Whole Home Mesh Router WiFi System Coverage up to 6,000 sq. ft, Plug and Play, Compatible with Alexa,Parental Controls,2 Gigabit Ports/Unit",189.99,0,https://www.amazon.ca/dp/B076JLJVTG/,https://m.media-amazon.com/images/I/41Ad4bOjuHS._AC_UL320_.jpg,Amazon,2021-10-31T16:21:02,https://www.amazon.ca/s?k=lightning+deals,-189.99
"Colorful Lightning Cable 2 Pack 1ft - USBC to Lightning & USB A to Lightning Compatible with iPhone, iPod and Cases - Cable Gear (i Products Phone Pad Pod)",18.99,0,https://www.amazon.ca/dp/B09KCKXVZM/,https://m.media-amazon.com/images/I/51tTBGwBHqL._AC_UL320_.jpg,Amazon,2021-10-31T16:21:02,https://www.amazon.ca/s?k=lightning+deals,-18.99
"Scotch Thermal Laminating Sheets, 9"" x 11.5"", 3-Mil Thick, 50 Laminating Pouches",18.97,0,https://www.amazon.ca/dp/B00GGBHMWQ/,https://m.media-amazon.com/images/I/712ktzRcrmL._AC_UL320_.jpg,Amazon,2021-10-31T16:21:02,https://www.amazon.ca/s?k=lightning+deals,-18.97
"CAT8 Ethernet Cable 15ft, High Speed 40Gbps 2000MHz SFTP Flat Internet Network LAN Cable with Gold Plated RJ45 Connector for Router, Modem, PC, Switches, Hub, Laptop, Gaming(White, 15ft/5m)",18.69,0,https://www.amazon.ca/dp/B0861BP8R6/,https://m.media-amazon.com/images/I/51MgByG9APL._AC_UL320_.jpg,Amazon,2021-10-31T16:21:02,https://www.amazon.ca/s?k=lightning+deals,-18.69
"New Beats Studio Buds – True Wireless Noise Cancelling Earbuds – Compatible with Apple & Android, Built-in Microphone, IPX4 Rating, Sweat Resistant Earphones, Class 1 Bluetooth Headphones - Black",179.95,0,https://www.amazon.ca/dp/B096SV8SJG/,https://m.media-amazon.com/images/I/51bRSWrEc7S._AC_UL320_.jpg,Amazon,2021-10-31T16:21:02,https://www.amazon.ca/s?k=lightning+deals,-179.95
14K White Gold Plated Cubic Zirconia Initial Necklace | Letter Necklaces for Women,17.95,0,https://www.amazon.ca/dp/B07QVZ3DB2/,https://m.media-amazon.com/images/I/61kRp4+Vk6L._AC_UL320_.jpg,Amazon,2021-10-31T16:21:02,https://www.amazon.ca/s?k=lightning+deals,-17.95
"Bose SoundLink Color II: Portable Bluetooth, Wireless Speaker with Microphone - Polar White",169.00,0,https://www.amazon.ca/dp/B01HETFQKI/,https://m.media-amazon.com/images/I/81KM62LB1uL._AC_UL320_.jpg,Amazon,2021-10-31T16:21:02,https://www.amazon.ca/s?k=lightning+deals,-169.0
Phone Charger 5Pack 3ft 3ft 6ft 6ft 10ft Nylon Braided Usb Charging & Syncing Cable Compatible with Phone12 12 Pro 12 Max Se Phone 11 Pro Max 11 Pro 11 XS MAX XR X 8 8 Plus 7 7 Plus 6s 6s Plus 6 6 Plus and More (Silver),16.99,0,https://www.amazon.ca/dp/B07R9KDMX1/,https://m.media-amazon.com/images/I/61Y7JeVsaWL._AC_UL320_.jpg,Amazon,2021-10-31T16:21:02,https://www.amazon.ca/s?k=lightning+deals,-16.99
