,Title,Price,Price_Origin,Link,Image,Retailer,TimeStamp,Source
271,Yannik Women's 5 Pair Pack Vintage Style Cotton Knitting Wool Winter Crew Socks,25.03,0,https://www.amazon.ca/dp/B01K1LS3H4/,https://m.media-amazon.com/images/I/81+AMzCCbiL._AC_UL320_.jpg,Amazon,2021-10-28T16:21:02,https://www.amazon.ca/s?k=lightning+deals
272,"5 Pack [Apple MFi Certified] Apple Charging Cables 10ft, iPhone Chargers Lightning Cable 3 Meter, Fast iPhone Charging Cord for iPhone 12/11/11Pro/11Max/ X/XS/XR/XS Max/8/7, ipad(White)",25.99,0,https://www.amazon.ca/dp/B09G2MDK6S/,https://m.media-amazon.com/images/I/61AD3YCkfRL._AC_UL320_.jpg,Amazon,2021-10-28T16:21:02,https://www.amazon.ca/s?k=lightning+deals
273,Women Short Sleeve Shirts Ladies Summer Tops Tunic Button Up Floral,23.99,30.99,https://www.amazon.ca/dp/B09CKYFBFX/,https://m.media-amazon.com/images/I/71vc4OUuv4L._AC_UL320_.jpg,Amazon,2021-10-28T16:21:02,https://www.amazon.ca/s?k=lightning+deals
274,Women's Halter Neck Summer Dress Sleeveless Casual Sundress,28.99,0,https://www.amazon.ca/dp/B06ZY964KQ/,https://m.media-amazon.com/images/I/51+klHQB81S._AC_UL320_.jpg,Amazon,2021-10-28T16:21:02,https://www.amazon.ca/s?k=lightning+deals
275,Fineliner Colored Pens Bullet Journal Planner Pen 24 Fine Tip Marker Drawing Pens for Writing Sketch Taking Note Calendar Coloring Book Art Supplies,12.99,0,https://www.amazon.ca/dp/B07JJBB8W6/,https://m.media-amazon.com/images/I/51u5tE+nE+L._AC_UL320_.jpg,Amazon,2021-10-28T16:21:02,https://www.amazon.ca/s?k=lightning+deals
276,Kid's W001954 Cars Analog Watch with Striped Nylon Band,19.61,26.99,https://www.amazon.ca/dp/B00QTJUP7Y/,https://m.media-amazon.com/images/I/81LE62YeVlL._AC_UL320_.jpg,Amazon,2021-10-28T16:21:02,https://www.amazon.ca/s?k=lightning+deals
277,Women Short Sleeve Strappy Cold Shoulder T-Shirt Tops Blouses,20.66,24.99,https://www.amazon.ca/dp/B07BSDS6V8/,https://m.media-amazon.com/images/I/61HDdwCCNhL._AC_UL320_.jpg,Amazon,2021-10-28T16:21:02,https://www.amazon.ca/s?k=lightning+deals
278,Samsung Portable SSD T5 1TB USB 3.1 External SSD (MU-PA1T0B/AM) [Canada Version],149.99,174.99,https://www.amazon.ca/dp/B073H552FJ/,https://m.media-amazon.com/images/I/81khZx00+tL._AC_UL320_.jpg,Amazon,2021-10-28T16:21:02,https://www.amazon.ca/s?k=lightning+deals
279,Womens Summer Tops Short Sleeve Button Up T Shirts Casual Crew Neck Flowy Tee Blouses S-XXL,23.99,33.99,https://www.amazon.ca/dp/B093BW2FJZ/,https://m.media-amazon.com/images/I/71ribkkPDES._AC_UL320_.jpg,Amazon,2021-10-28T16:21:02,https://www.amazon.ca/s?k=lightning+deals
280,Women's Tops Casual T-Shirt Long Sleeve Tunics Cotton Knits Tees,20.99,0,https://www.amazon.ca/dp/B08R8QLK85/,https://m.media-amazon.com/images/I/71vyDeCuq+L._AC_UL320_.jpg,Amazon,2021-10-28T16:21:02,https://www.amazon.ca/s?k=lightning+deals
281,"Disney and Pixar’s Cars Minis Advent Calendar Playset, One a Day Storytelling Racecar Accessories & Surprises, for Kids Age 3 Years and Older",29.99,0,https://www.amazon.ca/dp/B08V55DSS7/,https://m.media-amazon.com/images/I/81+2DrneD6S._AC_UL320_.jpg,Amazon,2021-10-28T16:21:02,https://www.amazon.ca/s?k=lightning+deals
282,Women's Mid-high Impact Comfortable Full Support Sports Bra with Removable Padding,30.99,0,https://www.amazon.ca/dp/B09BQX66WL/,https://m.media-amazon.com/images/I/71i+b1OBK+L._AC_UL320_.jpg,Amazon,2021-10-28T16:21:02,https://www.amazon.ca/s?k=lightning+deals
283,StarTech.com 6 Foot (2m) Durable White USB-C to Lightning Cable - Heavy Duty Rugged Aramid Fiber USB Type A to Lightning Charger/Sync Power Cord - Apple MFi Certified iPad/iPhone 12 (RUSBCLTMM2MW),33.40,0,https://www.amazon.ca/dp/B081HPWPZ8/,https://m.media-amazon.com/images/I/61nWwjG8mqL._AC_UL320_.jpg,Amazon,2021-10-28T16:21:02,https://www.amazon.ca/s?k=lightning+deals
284,Womens Underwear Beyondsoft Panties (Regular & Plus Size),30.99,0,https://www.amazon.ca/dp/B07L8YH7J6/,https://m.media-amazon.com/images/I/51XVzylu-dL._AC_UL320_.jpg,Amazon,2021-10-28T16:21:02,https://www.amazon.ca/s?k=lightning+deals
285,"Digital Luggage Scale, Fosmon Digital LCD Display Backlight with Temperature Sensor Hanging Luggage Weight Scale, Up to 50 Kilograms with Tare Function",15.99,0,https://www.amazon.ca/dp/B01N0Y9OWN/,https://m.media-amazon.com/images/I/61VdYidPqBL._AC_UL320_.jpg,Amazon,2021-10-28T16:21:02,https://www.amazon.ca/s?k=lightning+deals
286,"Memory Foam Pillow Neck Pillow for Sleeping, Cervical Pillow for Neck Pain, Bed Pillow for Side & Back Sleeper, Ergonomic Orthopedic Pillow for Comfort Spine,Side Sleeper Pillow with Velvet Pillowcase",39.99,0,https://www.amazon.ca/dp/B08PJ4FMW2/,https://m.media-amazon.com/images/I/61piISAxN5L._AC_UL320_.jpg,Amazon,2021-10-28T16:21:02,https://www.amazon.ca/s?k=lightning+deals
287,"Nano Towels ® - SUPERSIZED Version Of the Breakthrough Fabric That Replaces Expensive Paper Towels, and Toxic Chemical Cleaners. Use As Bath Towels, Kitchen Towels, etc. All Purpose Cleaning Wipes.",54.24,0,https://www.amazon.ca/dp/B018IONCI6/,https://m.media-amazon.com/images/I/81BtW2vj4PL._AC_UL320_.jpg,Amazon,2021-10-28T16:21:02,https://www.amazon.ca/s?k=lightning+deals
288,"Fosmon Digital LCD Display Backlight with Temperature Sensor Hanging Luggage Weight Scale, Up to 110LB with Tare Function",20.99,0,https://www.amazon.ca/dp/B01N5QP2I9/,https://m.media-amazon.com/images/I/71Ax0SVcr+L._AC_UL320_.jpg,Amazon,2021-10-28T16:21:02,https://www.amazon.ca/s?k=lightning+deals
289,Women's Flowy Tank Tops Summer Sleeveless Loose Fit Pleated Tunic Shirts,25.99,0,https://www.amazon.ca/dp/B07DL7DFHL/,https://m.media-amazon.com/images/I/618qUvNuD5L._AC_UL320_.jpg,Amazon,2021-10-28T16:21:02,https://www.amazon.ca/s?k=lightning+deals
290,Yoga Pants for Women Leggings with Side Pockets Workout Running Tights,29.99,51.90,https://www.amazon.ca/dp/B07DDFS6L4/,https://m.media-amazon.com/images/I/515egT0-o4L._AC_UL320_.jpg,Amazon,2021-10-28T16:21:02,https://www.amazon.ca/s?k=lightning+deals
291,Women's Slip On Shoes Athletic Walking Sneaker Lightweight Running Knit Breathable Casual Sport Shoes,33.99,39.99,https://www.amazon.ca/dp/B08GSHMGJJ/,https://m.media-amazon.com/images/I/71xl223TDCL._AC_UL320_.jpg,Amazon,2021-10-28T16:21:02,https://www.amazon.ca/s?k=lightning+deals
292,Women's Warm Sherpa Lined Athletic Sweatpants Jogger Pashm Pants Trousers,52.45,0,https://www.amazon.ca/dp/B08HJ74YQY/,https://m.media-amazon.com/images/I/613BygwIpxL._AC_UL320_.jpg,Amazon,2021-10-28T16:21:02,https://www.amazon.ca/s?k=lightning+deals
293,Women's Fleece Lined Leggings Winter Yoga Leggings Thermal High Waisted Pocketed Pants,42.99,0,https://www.amazon.ca/dp/B07WV7P745/,https://m.media-amazon.com/images/I/61JhMxQNlKL._AC_UL320_.jpg,Amazon,2021-10-28T16:21:02,https://www.amazon.ca/s?k=lightning+deals
294,Women's Jean Look Jeggings Tights Slimming Many Colors Spandex Leggings Pants Capri S-XXXL,36.25,0,https://www.amazon.ca/dp/B01MQKPG5D/,https://m.media-amazon.com/images/I/71plpWBAtdL._AC_UL320_.jpg,Amazon,2021-10-28T16:21:02,https://www.amazon.ca/s?k=lightning+deals
295,"Lovaefa | Pack of 10 | Cotton Women Socks | Unisex, No Show No See, Ultrasoft, Breathable, Low Cut",22.90,0,https://www.amazon.ca/dp/B09964DTW9/,https://m.media-amazon.com/images/I/61gF5Mt5eTL._AC_UL320_.jpg,Amazon,2021-10-28T16:21:02,https://www.amazon.ca/s?k=lightning+deals
