,Title,Price,Price_Origin,Link,Image,Retailer,TimeStamp,Source
88,"Wireless Earbuds Qualcomm Chip Apt-X Decoding CVC8.0 Noise Reduction Tech Bluetooth Earbuds Last for 8H Playtime, Built-in Mic Stereo Call Wireless Earphones Deep Bass Sound Bluetooth V5.0 Headphones with IPX8 Waterproof Snug for Sport Headsets",39.99,0,https://www.amazon.ca/dp/B09BYYZQFS/,https://m.media-amazon.com/images/I/61ICJH3V4OL._AC_UL320_.jpg,Amazon,2021-10-28T16:21:02,https://www.amazon.ca/s?k=lightning+deals
89,"iPhone Charger, 6Pack 3FT Lightning Cable Sundix iPhone Charger Cable Charging Cord Compatible iPhone Xs MAX XR X 8 8Plus 7 7Plus 6s 6sPlus 6 6Plus SE 5 SE iPad iPod & More (White)",18.59,20.99,https://www.amazon.ca/dp/B07W54VLPQ/,https://m.media-amazon.com/images/I/61REAdEEaEL._AC_UL320_.jpg,Amazon,2021-10-28T16:21:02,https://www.amazon.ca/s?k=lightning+deals
90,Womens 18 Hour Ultimate Lift and Support Wire Free Bra,32.41,0,https://www.amazon.ca/dp/B07DNWRQ3Y/,https://m.media-amazon.com/images/I/71r9GHEdU5S._AC_UL320_.jpg,Amazon,2021-10-28T16:21:02,https://www.amazon.ca/s?k=lightning+deals
91,"EverBrite 5-Pack LED Headlamp Flashlight for Running, Camping, Reading, Fishing, Hunting, Walking, Jogging - Head Lamps Long Battery Life (Batteries Included), Durable, Lightweight",29.99,0,https://www.amazon.ca/dp/B01CTX7BX4/,https://m.media-amazon.com/images/I/81cFtahSCrL._AC_UL320_.jpg,Amazon,2021-10-28T16:21:02,https://www.amazon.ca/s?k=lightning+deals
92,Slim Minimalist Front Pocket RFID Blocking Leather Wallets for Men Women - Cross Black,15.99,0,https://www.amazon.ca/dp/B079DCW7GB/,https://m.media-amazon.com/images/I/81oIi9rFU6L._AC_UL320_.jpg,Amazon,2021-10-28T16:21:02,https://www.amazon.ca/s?k=lightning+deals
93,Women's Racerback Sports Bra High Impact Support for Yoga Workout Gym Activewear Bra,25.99,0,https://www.amazon.ca/dp/B09BQPLPG9/,https://m.media-amazon.com/images/I/61Vu+PxZ4nS._AC_UL320_.jpg,Amazon,2021-10-28T16:21:02,https://www.amazon.ca/s?k=lightning+deals
94,Womens Striped Color Block Long Sleeve Pullover Hoodies Sweatshirts Drawstring Tops,32.88,0,https://www.amazon.ca/dp/B099KH7MLG/,https://m.media-amazon.com/images/I/61KVrWujjhL._AC_UL320_.jpg,Amazon,2021-10-28T16:21:02,https://www.amazon.ca/s?k=lightning+deals
95,"3D Sleep Mask By PrettyCare 2 Pack (Blue and Black) Eye Mask for Sleeping, Contoured Sleep Mask Blindfold with an Ear Plugs, Silk Travel Bag, Night Eyeshade for Men and Women",19.95,0,https://www.amazon.ca/dp/B019JY9BO8/,https://m.media-amazon.com/images/I/71ZjRCUL1pL._AC_UL320_.jpg,Amazon,2021-10-28T16:21:02,https://www.amazon.ca/s?k=lightning+deals
96,"BESTOPE Blackhead Remover Pimple Comedone Extractor Tool Best Acne Removal Kit - Treatment for Blemish, Whitehead Popping, Zit Removing for Risk Free Nose Face Skin with Metal Case",12.99,0,https://www.amazon.ca/dp/B01M6D0T9R/,https://m.media-amazon.com/images/I/71PAR7pMutL._AC_UL320_.jpg,Amazon,2021-10-28T16:21:02,https://www.amazon.ca/s?k=lightning+deals
97,"Mellanni Bed Sheet Set - HIGHEST QUALITY Brushed Microfiber 1800 Bedding - Deep Pocket, Wrinkle, Fade, Stain Resistant - Hypoallergenic - 4 Piece - Queen, Emerald Green",50.42,0,https://www.amazon.ca/dp/B01DN0ALM0/,https://m.media-amazon.com/images/I/619e-7L+jkL._AC_UL320_.jpg,Amazon,2021-10-28T16:21:02,https://www.amazon.ca/s?k=lightning+deals
98,"Belkin Powerhouse Charge Dock for Apple Watch + iPhone Charging Dock for iPhone Xs, XS Max, XR, X, 8/8 Plus and More, Apple Watch Series 4, 3, 2, 1 (White)",129.99,0,https://www.amazon.ca/dp/B07HMBQL58/,https://m.media-amazon.com/images/I/61Ug8s83ccL._AC_UL320_.jpg,Amazon,2021-10-28T16:21:02,https://www.amazon.ca/s?k=lightning+deals
99,Love Cat Heart Pendant Necklace for Women Crystal Necklace Birthday Jewelry Gifts for Mom Daughter Girlfriend,26.34,30.99,https://www.amazon.ca/dp/B088314D2P/,https://m.media-amazon.com/images/I/61n2jZZGiuL._AC_UL320_.jpg,Amazon,2021-10-28T16:21:02,https://www.amazon.ca/s?k=lightning+deals
100,Polarized Sunglasses for Men and Women Semi-Rimless Frame Driving Sun glasses 100% UV Blocking,32.99,0,https://www.amazon.ca/dp/B07MW7BBX5/,https://m.media-amazon.com/images/I/61HTfyHff1L._AC_UL320_.jpg,Amazon,2021-10-28T16:21:02,https://www.amazon.ca/s?k=lightning+deals
101,Womens Full_Coverage,32.47,0,https://www.amazon.ca/dp/B00551OS70/,https://m.media-amazon.com/images/I/91llrJB8uGL._AC_UL320_.jpg,Amazon,2021-10-28T16:21:02,https://www.amazon.ca/s?k=lightning+deals
102,Women's Drawstring Hoodies Sweatshirts with Pockets Long Sleeve Pullover Hoodie Tops for Women Tunic,32.99,0,https://www.amazon.ca/dp/B08KDWHSZQ/,https://m.media-amazon.com/images/I/71zZ4XbIcOL._AC_UL320_.jpg,Amazon,2021-10-28T16:21:02,https://www.amazon.ca/s?k=lightning+deals
103,Men's Chiba,90.00,0,https://www.amazon.ca/dp/B001L1SB44/,https://m.media-amazon.com/images/I/81s8gEmRNnL._AC_UL320_.jpg,Amazon,2021-10-28T16:21:02,https://www.amazon.ca/s?k=lightning+deals
104,Men's Classic Black Resin Strap Watch Digital F91W-1,20.75,24.00,https://www.amazon.ca/dp/B000GAWSDG/,https://m.media-amazon.com/images/I/71EMyUkCSLS._AC_UL320_.jpg,Amazon,2021-10-28T16:21:02,https://www.amazon.ca/s?k=lightning+deals
105,Women's Crest Vibe Sneaker,70.53,80.00,https://www.amazon.ca/dp/B07VFWHDLZ/,https://m.media-amazon.com/images/I/71KiKlI3zaL._AC_UL320_.jpg,Amazon,2021-10-28T16:21:02,https://www.amazon.ca/s?k=lightning+deals
106,Women Zipper Hoodie Hooded Sweatshirt Coat Jacket Casual Slim Jumper,9.43,0,https://www.amazon.ca/dp/B07K42YV32/,https://m.media-amazon.com/images/I/51h8jgh9O6L._AC_UL320_.jpg,Amazon,2021-10-28T16:21:02,https://www.amazon.ca/s?k=lightning+deals
107,"Women’s Organic Cotton Stretch Bikini Panties 6-Pack, Oeko-TEX Standard, Black, Blue, Grey Underwear",32.95,0,https://www.amazon.ca/dp/B084KJ3XLC/,https://m.media-amazon.com/images/I/71xa9Z10wEL._AC_UL320_.jpg,Amazon,2021-10-28T16:21:02,https://www.amazon.ca/s?k=lightning+deals
108,Making Magic Happen Shirts for Womens Casual Short Sleeve Tops Soft T-Shirts with Sayings,13.59,21.41,https://www.amazon.ca/dp/B01HEPE1N0/,https://m.media-amazon.com/images/I/51C8e8gcLgL._AC_UL320_.jpg,Amazon,2021-10-28T16:21:02,https://www.amazon.ca/s?k=lightning+deals
109,Fast Charging 5 Pack (3-3-6-6-10FT) iPhone Charger 90 Degree Data Cable Compatible with iPhone 12/11/ Pro/Max/X/XS/XR/XS Max/ 8/ Plus/7/7 Plus/6/6S/6 Plus (Red Black),19.99,22.99,https://www.amazon.ca/dp/B07QVXH6J3/,https://m.media-amazon.com/images/I/61N0zbqvUzL._AC_UL320_.jpg,Amazon,2021-10-28T16:21:02,https://www.amazon.ca/s?k=lightning+deals
110,Women's Long Sleeve V Neck Chiffon Blouses Tops Button Down Business Shirts,19.99,0,https://www.amazon.ca/dp/B099683HRM/,https://m.media-amazon.com/images/I/71a7Cl2XAOS._AC_UL320_.jpg,Amazon,2021-10-28T16:21:02,https://www.amazon.ca/s?k=lightning+deals
111,"SHW Home Office Computer Desks, Black, 48-Inch (121 cm W x 60 cm D)",99.87,0,https://www.amazon.ca/dp/B07Q33BDKC/,https://m.media-amazon.com/images/I/81FeCI035nL._AC_UL320_.jpg,Amazon,2021-10-28T16:21:02,https://www.amazon.ca/s?k=lightning+deals
112,"Mens Leather Bracelet Magnetic-Clasp Cowhide Braided Multi-Layer Wrap Mens Bracelet,7""-8.7""",19.99,0,https://www.amazon.ca/dp/B01I174YPK/,https://m.media-amazon.com/images/I/61pqEbnCTGL._AC_UL320_.jpg,Amazon,2021-10-28T16:21:02,https://www.amazon.ca/s?k=lightning+deals
113,"iPhone 12 Charger Cable, USB C to Lightning Fast Charging Cable 6.6ft MFi Certified for iPhone 12, 12 Pro Max, 12 Mini, iPhone 11 Pro Max, X, XS, XR, 8, iPad Pro 12.9 inch Gen 1/2, iPad Air 3, Mini 5",14.98,0,https://www.amazon.ca/dp/B08LNHZLK7/,https://m.media-amazon.com/images/I/51Aw0Aors6L._AC_UL320_.jpg,Amazon,2021-10-28T16:21:02,https://www.amazon.ca/s?k=lightning+deals
114,Womens Blissful Benefits No Muffin Top 3 Pack Lace Hipster Panties Hipster Panties,16.99,0,https://www.amazon.ca/dp/B076DV59NP/,https://m.media-amazon.com/images/I/8178jHEULtS._AC_UL320_.jpg,Amazon,2021-10-28T16:21:02,https://www.amazon.ca/s?k=lightning+deals
115,Women's High Waisted Cotton Underwear Stretch Briefs Soft Full Coverage Panties Multipack (Regular& Plus Size),29.99,40.99,https://www.amazon.ca/dp/B07RN63526/,https://m.media-amazon.com/images/I/61dpCKpdjHL._AC_UL320_.jpg,Amazon,2021-10-28T16:21:02,https://www.amazon.ca/s?k=lightning+deals
116,Womens Color Block Tunic Tops Crewneck Long Sleeve T-Shirt Casual Loose Shirt Blouses with Pocket S-XXL,32.99,0,https://www.amazon.ca/dp/B08S3257FY/,https://m.media-amazon.com/images/I/61WQ7S3gLvL._AC_UL320_.jpg,Amazon,2021-10-28T16:21:02,https://www.amazon.ca/s?k=lightning+deals
117,Women's Jean Look Jeggings Tights Slimming Many Colors Spandex Leggings Pants Capri S-XXXL,36.25,0,https://www.amazon.ca/dp/B01MQKPG5D/,https://m.media-amazon.com/images/I/71plpWBAtdL._AC_UL320_.jpg,Amazon,2021-10-28T16:21:02,https://www.amazon.ca/s?k=lightning+deals
118,"Lovaefa | Pack of 10 | Cotton Women Socks | Unisex, No Show No See, Ultrasoft, Breathable, Low Cut",22.90,0,https://www.amazon.ca/dp/B09964DTW9/,https://m.media-amazon.com/images/I/61gF5Mt5eTL._AC_UL320_.jpg,Amazon,2021-10-28T16:21:02,https://www.amazon.ca/s?k=lightning+deals
119,Saxx Men's Underwear – Vibe Men’s Underwear – Boxer Briefs with Built-in Ballpark Pouch Support - Core,33.95,0,https://www.amazon.ca/dp/B016OE5PJQ/,https://m.media-amazon.com/images/I/81QxKJJVcDL._AC_UL320_.jpg,Amazon,2021-10-28T16:21:02,https://www.amazon.ca/s?k=lightning+deals
120,Women's Fleece Lined Water Resistant Legging High Waisted Thermal Winter Hiking Running Tights Pockets,33.99,41.99,https://www.amazon.ca/dp/B08JZ35F59/,https://m.media-amazon.com/images/I/51qZSUaD8DL._AC_UL320_.jpg,Amazon,2021-10-28T16:21:02,https://www.amazon.ca/s?k=lightning+deals
121,"Lindt Creation Dessert Assorted Chocolates Gift Box, 400 Grams",28.49,0,https://www.amazon.ca/dp/B07G3PS3ZC/,https://m.media-amazon.com/images/I/81auUx+YKRL._AC_UL320_.jpg,Amazon,2021-10-28T16:21:02,https://www.amazon.ca/s?k=lightning+deals
122,Slim Minimalist Front Pocket RFID Blocking Leather Wallets for Men Women - Cross Black,15.99,0,https://www.amazon.ca/dp/B079DCW7GB/,https://m.media-amazon.com/images/I/81oIi9rFU6L._AC_UL320_.jpg,Amazon,2021-10-28T16:21:02,https://www.amazon.ca/s?k=lightning+deals
123,Mens Covered Waistband Boxer Brief Multipack,27.38,0,https://www.amazon.ca/dp/B077ZMVNRW/,https://m.media-amazon.com/images/I/81WPiqkwWpL._AC_UL320_.jpg,Amazon,2021-10-28T16:21:02,https://www.amazon.ca/s?k=lightning+deals
124,Women's Drawstring Hoodies Sweatshirts with Pockets Long Sleeve Pullover Hoodie Tops for Women Tunic,32.99,0,https://www.amazon.ca/dp/B08KDWHSZQ/,https://m.media-amazon.com/images/I/71zZ4XbIcOL._AC_UL320_.jpg,Amazon,2021-10-28T16:21:02,https://www.amazon.ca/s?k=lightning+deals
125,"K-Y Personal Lubricant, Gel 113 gram",5.99,0,https://www.amazon.ca/dp/B00WLKYOC2/,https://m.media-amazon.com/images/I/51kr2BgSe5L._AC_UL320_.jpg,Amazon,2021-10-28T16:21:02,https://www.amazon.ca/s?k=lightning+deals
126,Mens Jersey Short with Pockets,16.73,0,https://www.amazon.ca/dp/B01BUJ0NZQ/,https://m.media-amazon.com/images/I/81vAeOQuDWL._AC_UL320_.jpg,Amazon,2021-10-28T16:21:02,https://www.amazon.ca/s?k=lightning+deals
127,"Women's Cotton Stretch Bikini Panty, 6-Pack",28.30,0,https://www.amazon.ca/dp/B07CJWMX3L/,https://m.media-amazon.com/images/I/81fAV6xoncL._AC_UL320_.jpg,Amazon,2021-10-28T16:21:02,https://www.amazon.ca/s?k=lightning+deals
128,Womens Underwear Varity of Underwear for Women Pack Briefs Thongs Boxer Lacy Panties Tanga 10 Pack,27.99,0,https://www.amazon.ca/dp/B07QGJSSB3/,https://m.media-amazon.com/images/I/71+UtWnr3dL._AC_UL320_.jpg,Amazon,2021-10-28T16:21:02,https://www.amazon.ca/s?k=lightning+deals
129,"QGECEN Thunderbolt to HDMI Cable, Mini Displayport to HDMI Cable, Mini DP to HDMI Cable for for MacBook, iMac, Mac mini, Mac Pro; Microsoft Surface and More, Supports 4K, 1080P, HDCP, 3D - 6Ft",10.99,0,https://www.amazon.ca/dp/B08HYM3155/,https://m.media-amazon.com/images/I/61c3CVUA8lL._AC_UL320_.jpg,Amazon,2021-10-28T16:21:02,https://www.amazon.ca/s?k=lightning+deals
130,"AmazonBasics Light-Weight Microfiber Sheet Set - Full, Navy Pinstripe",30.64,0,https://www.amazon.ca/dp/B07QT9NZFK/,https://m.media-amazon.com/images/I/81iAeI27P+L._AC_UL320_.jpg,Amazon,2021-10-28T16:21:02,https://www.amazon.ca/s?k=lightning+deals
131,Cliganic USDA Organic Lip Balm Set - 6 Flavors - 100% Natural Moisturizer for Cracked & Dry Lips,9.99,0,https://www.amazon.ca/dp/B07X62WVM4/,https://m.media-amazon.com/images/I/71YbzhEU2AL._AC_UL320_.jpg,Amazon,2021-10-28T16:21:02,https://www.amazon.ca/s?k=lightning+deals
132,"Scotch Thermal Laminating Sheets, 9"" x 11.5"", 3-Mil Thick, 50 Laminating Pouches",18.97,0,https://www.amazon.ca/dp/B00GGBHMWQ/,https://m.media-amazon.com/images/I/712ktzRcrmL._AC_UL320_.jpg,Amazon,2021-10-28T16:21:02,https://www.amazon.ca/s?k=lightning+deals
133,womens Performance Heel Tab Athletic Socks (8 & 16 Pairs),32.49,0,https://www.amazon.ca/dp/B07MRC3ZC2/,https://m.media-amazon.com/images/I/91x8tpSy3TL._AC_UL320_.jpg,Amazon,2021-10-28T16:21:02,https://www.amazon.ca/s?k=lightning+deals
134,Men's White Ledge Mid Waterproof Hiking Boot,146.05,0,https://www.amazon.ca/dp/B005MI8JM6/,https://m.media-amazon.com/images/I/81BiW8VztAL._AC_UL320_.jpg,Amazon,2021-10-28T16:21:02,https://www.amazon.ca/s?k=lightning+deals
135,Women's Faith Casual Sweatshirts Hoodie Long Sleeve Sweatshirts,25.77,0,https://www.amazon.ca/dp/B07W8XF7XK/,https://m.media-amazon.com/images/I/51HFIq2wjPL._AC_UL320_.jpg,Amazon,2021-10-28T16:21:02,https://www.amazon.ca/s?k=lightning+deals
136,Womens Blissful Benefits No Muffin Top 3 Pack Brief Panty,14.29,0,https://www.amazon.ca/dp/B076DV9S8K/,https://m.media-amazon.com/images/I/61cT2HjFeXS._AC_UL320_.jpg,Amazon,2021-10-28T16:21:02,https://www.amazon.ca/s?k=lightning+deals
137,Women's Colby Fashion Casual Over The Knee Pull On Slouchy Boots,57.99,0,https://www.amazon.ca/dp/B072KLS8WH/,https://m.media-amazon.com/images/I/61RZmaXT8ZS._AC_UL320_.jpg,Amazon,2021-10-28T16:21:02,https://www.amazon.ca/s?k=lightning+deals
138,"Introducing Fire TV Stick 4K Max streaming device, Wi-Fi 6, Alexa Voice Remote (includes TV controls)",74.99,0,https://www.amazon.ca/dp/B08MR2C1T7/,https://m.media-amazon.com/images/I/41LQZ3weaVL._AC_UL320_.jpg,Amazon,2021-10-28T16:21:02,https://www.amazon.ca/s?k=lightning+deals
139,"250W LED High Bay Light 35,000LM (140Lm/w) 5000K Daylight (for 18 to 24ft Ceiling, 1000W HID/HPS Replacement) 1-10v dimmer UL Listed HYPERLITE High Bay LED Light for Factory Warehouse Church",189.99,0,https://www.amazon.ca/dp/B07WLVG6RX/,https://m.media-amazon.com/images/I/612N0b-IwbL._AC_UL320_.jpg,Amazon,2021-10-28T16:21:02,https://www.amazon.ca/s?k=lightning+deals
140,"LittleSun LED Garage Light 4+1 Deformable LED Garage Lighting, 48W, 5000LM, CRI 90+, 6500K,Ideal LED Lighting for Garage, Shop,Basement, Warehouse,White, Pack (1)",20.99,0,https://www.amazon.ca/dp/B082N9NTXW/,https://m.media-amazon.com/images/I/717sEGXAhOL._AC_UL320_.jpg,Amazon,2021-10-28T16:21:02,https://www.amazon.ca/s?k=lightning+deals
141,Women's High Waisted Yoga Pants with Pockets Tummy Control Workout Leggings,32.99,0,https://www.amazon.ca/dp/B09B27FF5P/,https://m.media-amazon.com/images/I/51ZnQzxwR-L._AC_UL320_.jpg,Amazon,2021-10-28T16:21:02,https://www.amazon.ca/s?k=lightning+deals
142,High Waisted Leggings for Women Tummy Control Workout Running Yoga Pants with Pockets,30.99,0,https://www.amazon.ca/dp/B09BMXG3N9/,https://m.media-amazon.com/images/I/61BQlQGKPrL._AC_UL320_.jpg,Amazon,2021-10-28T16:21:02,https://www.amazon.ca/s?k=lightning+deals
143,"Fast Charge 3.0, Excgood [2-Pack] 18W Flat QC USB Wall Charger Foldable Fast Charger Block Compatible with Wireless Charger, Samsung Galaxy S10/8/9,Note9/8,LG G5/6 V20/30,HTC,iPhone,iPad,- White",18.99,0,https://www.amazon.ca/dp/B088H39V22/,https://m.media-amazon.com/images/I/6119iwG53-L._AC_UL320_.jpg,Amazon,2021-10-28T16:21:02,https://www.amazon.ca/s?k=lightning+deals
144,"Motion Sensor Light Bulb- 2 Pack, AmeriTop 10W(60W Equivalent) 806lm Motion Activated Dusk to Dawn Security LED Bulb; UL Listed, A19, E26, Auto On/Off Indoor Outdoor Lighting (5000K Daylight)",19.99,0,https://www.amazon.ca/dp/B08CWZKMJ7/,https://m.media-amazon.com/images/I/51jtSUePAzL._AC_UL320_.jpg,Amazon,2021-10-28T16:21:02,https://www.amazon.ca/s?k=lightning+deals
145,Women's Faux Fur-Lined Knee High Winter Boots,55.99,0,https://www.amazon.ca/dp/B01G9CTGNE/,https://m.media-amazon.com/images/I/61TJKQ-w4QL._AC_UL320_.jpg,Amazon,2021-10-28T16:21:02,https://www.amazon.ca/s?k=lightning+deals
146,Women Zipper Hoodie Hooded Sweatshirt Coat Jacket Casual Slim Jumper,9.43,0,https://www.amazon.ca/dp/B07K42YV32/,https://m.media-amazon.com/images/I/51h8jgh9O6L._AC_UL320_.jpg,Amazon,2021-10-28T16:21:02,https://www.amazon.ca/s?k=lightning+deals
147,"SPRINGSPIRIT Waterproof Mattress Protector Bamboo Twin Size Hypoallergenic Vinyl Free TPU Noiseless Bed Mattress Cover, Ultra Breathable Premium 100% Bamboo Jersey Single Mattress Protector Fitted up to 14'' Depth Pocket (39 x 75inch)",29.99,0,https://www.amazon.ca/dp/B08BCDD4QR/,https://m.media-amazon.com/images/I/71yAdbbfIzL._AC_UL320_.jpg,Amazon,2021-10-28T16:21:02,https://www.amazon.ca/s?k=lightning+deals
148,"JUANWE USB Type-C Flash Drive 64GB Dual Drive USB 3.0 Thumb Drive Memory Stick for USB-C Smartphones,New MacBook & Tablets,Samsung Galaxy S8/S8+/S9/S9+,Note7/8/9,A6S/A9S,Google Pixel,LG,Hua Wei,Blue",13.99,0,https://www.amazon.ca/dp/B07LBRKR5J/,https://m.media-amazon.com/images/I/51JLMbYxGoS._AC_UL320_.jpg,Amazon,2021-10-28T16:21:02,https://www.amazon.ca/s?k=lightning+deals
149,"Betty Crocker Gluten Free Fruit Snacks Special Edition, 10-Count, 226 Gram",3.00,0,https://www.amazon.ca/dp/B00V4HQXIG/,https://m.media-amazon.com/images/I/919cadZv2aL._AC_UL320_.jpg,Amazon,2021-10-28T16:21:02,https://www.amazon.ca/s?k=lightning+deals
150,"Women's Comfortable Orthotic Flip-Flops Sandal (US Women 9, Matt Wine)",41.99,0,https://www.amazon.ca/dp/B07B2VC51J/,https://m.media-amazon.com/images/I/71Xgg-5ceaS._AC_UL320_.jpg,Amazon,2021-10-28T16:21:02,https://www.amazon.ca/s?k=lightning+deals
151,Women’s This is Not a Bra Full-Coverage Underwire Bra,33.50,0,https://www.amazon.ca/dp/B00378LD9O/,https://m.media-amazon.com/images/I/71OTr-rHZmL._AC_UL320_.jpg,Amazon,2021-10-28T16:21:02,https://www.amazon.ca/s?k=lightning+deals
152,"Fractionated Coconut Oil - Relaxing Massage Oil, Liquid Carrier Oil for Diluting Essential Oils - Skin, Lip, Body & Hair Oil Moisturizer & Softener - 16 fl oz",23.96,0,https://www.amazon.ca/dp/B00PMR3QF2/,https://m.media-amazon.com/images/I/61OZP3bI-UL._AC_UL320_.jpg,Amazon,2021-10-28T16:21:02,https://www.amazon.ca/s?k=lightning+deals
153,KZ AZ09 Bluetooth 5.2 IPV5 Waterproof Noise Reduction Bluetooth Module Upgrade Cable Ear Hook for ZSX/ZSN/ZSNPRO/ZSNProX/ZS10PRO/AS12/AS16/ZAX/DQ6(C pin),31.99,33.99,https://www.amazon.ca/dp/B09292MSTF/,https://m.media-amazon.com/images/I/61LJrYgVPeL._AC_UL320_.jpg,Amazon,2021-10-28T16:21:02,https://www.amazon.ca/s?k=lightning+deals
154,Women’s Built Up Tank Style Sports Bra,20.99,0,https://www.amazon.ca/dp/B07KSRF8N8/,https://m.media-amazon.com/images/I/71UZglYTV6L._AC_UL320_.jpg,Amazon,2021-10-28T16:21:02,https://www.amazon.ca/s?k=lightning+deals
155,Mens Coolzone Boxer Briefs (Assorted Colors),29.94,0,https://www.amazon.ca/dp/B07P7KKGY2/,https://m.media-amazon.com/images/I/81sjQjabxFL._AC_UL320_.jpg,Amazon,2021-10-28T16:21:02,https://www.amazon.ca/s?k=lightning+deals
156,Men’s EcoSmart Fleece Sweatshirt,13.99,0,https://www.amazon.ca/dp/B071GCRXCV/,https://m.media-amazon.com/images/I/81fBr0EGoQL._AC_UL320_.jpg,Amazon,2021-10-28T16:21:02,https://www.amazon.ca/s?k=lightning+deals
157,"Nature's Blossom Bonsai Tree Kit - Grow 4 Types of Bonsai Trees From Seed. Indoor / Outdoor Gardening Starter Set with Tree Seeds, Soil, Pots, Labels, Growing Guide.",85.00,0,https://www.amazon.ca/dp/B01EFX6VMS/,https://m.media-amazon.com/images/I/91sYBVxTXgL._AC_UL320_.jpg,Amazon,2021-10-28T16:21:02,https://www.amazon.ca/s?k=lightning+deals
158,Women's Jersey Full Zip Hoodie,20.64,0,https://www.amazon.ca/dp/B016YKLC92/,https://m.media-amazon.com/images/I/81bO1PWtEUL._AC_UL320_.jpg,Amazon,2021-10-28T16:21:02,https://www.amazon.ca/s?k=lightning+deals
159,Mens Boxer Brief,24.98,0,https://www.amazon.ca/dp/B07THBK2Y1/,https://m.media-amazon.com/images/I/81AflRbL35L._AC_UL320_.jpg,Amazon,2021-10-28T16:21:02,https://www.amazon.ca/s?k=lightning+deals
160,Women's Comfort Revolution Wire Free,32.79,0,https://www.amazon.ca/dp/B00550PNLQ/,https://m.media-amazon.com/images/I/71AKCApXCcL._AC_UL320_.jpg,Amazon,2021-10-28T16:21:02,https://www.amazon.ca/s?k=lightning+deals
161,Women Button Down Blouse Long Sleeve T Shirts Casual Henley Tunic Tops,28.85,0,https://www.amazon.ca/dp/B08M9N8HJW/,https://m.media-amazon.com/images/I/61xnty3MZLL._AC_UL320_.jpg,Amazon,2021-10-28T16:21:02,https://www.amazon.ca/s?k=lightning+deals
162,Apple Watch Magnetic Fast Charger to USB-C Cable (1m),39.99,0,https://www.amazon.ca/dp/B09G9KZV1Q/,https://m.media-amazon.com/images/I/51pSFMSWEiL._AC_UL320_.jpg,Amazon,2021-10-28T16:21:02,https://www.amazon.ca/s?k=lightning+deals
163,"LED Garage Light 80W E26 E27 8000LM Deformable LED Garage Ceiling Lights 6000K Daylight White Garage LED Light with 5 Adjustable LED Panels, LED Garage Lights for Warehouse Workshop Basement Lights - 2pack",39.99,0,https://www.amazon.ca/dp/B08K75G9DP/,https://m.media-amazon.com/images/I/71F0ygKZzfL._AC_UL320_.jpg,Amazon,2021-10-28T16:21:02,https://www.amazon.ca/s?k=lightning+deals
164,"GYUEM 18 feet Inflatable Outdoor Projector Movie Screen - Package with Rope, Blower, Tent Stakes - Portable,Great for Outdoor and Indoor Party Backyard Pool Watch Movies",179.99,196.99,https://www.amazon.ca/dp/B07GGSYNF7/,https://m.media-amazon.com/images/I/717hpr3LBVS._AC_UL320_.jpg,Amazon,2021-10-28T16:21:02,https://www.amazon.ca/s?k=lightning+deals
165,Women's Gel-Venture 5-w,166.32,0,https://www.amazon.ca/dp/B00NUY58ZU/,https://m.media-amazon.com/images/I/81z5Lu9+XQL._AC_UL320_.jpg,Amazon,2021-10-28T16:21:02,https://www.amazon.ca/s?k=lightning+deals
166,Women Side Zipper Casaul Hoodies Long Sleeve Warm Sweatshirt,25.00,35.49,https://www.amazon.ca/dp/B0792X2MFR/,https://m.media-amazon.com/images/I/61wESzFrtsL._AC_UL320_.jpg,Amazon,2021-10-28T16:21:02,https://www.amazon.ca/s?k=lightning+deals
167,"TubShroom TSBLU454 The Revolutionary Tub Drain Protector Hair Catcher/Strainer/Snare, Blue",14.99,0,https://www.amazon.ca/dp/B01BYRMGCC/,https://m.media-amazon.com/images/I/71HQOgqyyXS._AC_UL320_.jpg,Amazon,2021-10-28T16:21:02,https://www.amazon.ca/s?k=lightning+deals
168,"Full HD Bluetooth Projector Built in DVD Player, 7000LM 1080P Supported, Portable Mini DVD Projector for Outdoor Movies, 250"" Home Theater, Compatible with iOS/Android/TV Stick/PS4/HDMI/USB/TF Card",178.48,249.99,https://www.amazon.ca/dp/B08SKHN885/,https://m.media-amazon.com/images/I/71ji0j52SoL._AC_UL320_.jpg,Amazon,2021-10-28T16:21:02,https://www.amazon.ca/s?k=lightning+deals
169,womens Non Terry No Show Low Cut Athletic Sport Sock 6-pack,12.84,22.99,https://www.amazon.ca/dp/B017XVZ062/,https://m.media-amazon.com/images/I/711wQ8V4zzS._AC_UL320_.jpg,Amazon,2021-10-28T16:21:02,https://www.amazon.ca/s?k=lightning+deals
170,Women's Off One Shoulder Tops Long Sleeve Pullover Slouchy Baggy Sweater,37.99,0,https://www.amazon.ca/dp/B07KFV9SXH/,https://m.media-amazon.com/images/I/616eTbG0QpL._AC_UL320_.jpg,Amazon,2021-10-28T16:21:02,https://www.amazon.ca/s?k=lightning+deals
171,"ACDelco AAA Super Alkaline Batteries in Recloseable Package, 24 Count , Blue",9.10,0,https://www.amazon.ca/dp/B00A9WM94E/,https://m.media-amazon.com/images/I/81d18kujihL._AC_UL320_.jpg,Amazon,2021-10-28T16:21:02,https://www.amazon.ca/s?k=lightning+deals
172,"womens Essential No Show Socks, 6-pairs",25.99,0,https://www.amazon.ca/dp/B013P2HQUQ/,https://m.media-amazon.com/images/I/91U1-ONpXxL._AC_UL320_.jpg,Amazon,2021-10-28T16:21:02,https://www.amazon.ca/s?k=lightning+deals
173,Womens Stretch Denim Leggings with Pockets,23.19,0,https://www.amazon.ca/dp/B01HIK9DU2/,https://m.media-amazon.com/images/I/81u5MmDfVxL._AC_UL320_.jpg,Amazon,2021-10-28T16:21:02,https://www.amazon.ca/s?k=lightning+deals
174,Women's Fleece Lined Leggings Winter Yoga Leggings Thermal High Waisted Pocketed Pants,42.99,0,https://www.amazon.ca/dp/B07WV7P745/,https://m.media-amazon.com/images/I/61JhMxQNlKL._AC_UL320_.jpg,Amazon,2021-10-28T16:21:02,https://www.amazon.ca/s?k=lightning+deals
175,Womens Color Block Tunic Tops Crewneck Long Sleeve T-Shirt Casual Loose Shirt Blouses with Pocket S-XXL,32.99,0,https://www.amazon.ca/dp/B08S3257FY/,https://m.media-amazon.com/images/I/61WQ7S3gLvL._AC_UL320_.jpg,Amazon,2021-10-28T16:21:02,https://www.amazon.ca/s?k=lightning+deals
176,Women's High Waisted Cotton Underwear Stretch Briefs Soft Full Coverage Panties Multipack (Regular& Plus Size),29.99,40.99,https://www.amazon.ca/dp/B07RN63526/,https://m.media-amazon.com/images/I/61dpCKpdjHL._AC_UL320_.jpg,Amazon,2021-10-28T16:21:02,https://www.amazon.ca/s?k=lightning+deals
177,Women's Jean Look Jeggings Tights Slimming Many Colors Spandex Leggings Pants Capri S-XXXL,36.25,0,https://www.amazon.ca/dp/B01MQKPG5D/,https://m.media-amazon.com/images/I/71plpWBAtdL._AC_UL320_.jpg,Amazon,2021-10-28T16:21:02,https://www.amazon.ca/s?k=lightning+deals
178,Saxx Men's Underwear – Vibe Men’s Underwear – Boxer Briefs with Built-in Ballpark Pouch Support - Core,33.95,0,https://www.amazon.ca/dp/B016OE5PJQ/,https://m.media-amazon.com/images/I/81QxKJJVcDL._AC_UL320_.jpg,Amazon,2021-10-28T16:21:02,https://www.amazon.ca/s?k=lightning+deals
179,"Lindt Creation Dessert Assorted Chocolates Gift Box, 400 Grams",28.49,0,https://www.amazon.ca/dp/B07G3PS3ZC/,https://m.media-amazon.com/images/I/81auUx+YKRL._AC_UL320_.jpg,Amazon,2021-10-28T16:21:02,https://www.amazon.ca/s?k=lightning+deals
